recipe_id,note_descript
7642,Vero tempore earum perspiciatis.
7643,Unde quibusdam aut distinctio.
7644,Officia qui fuga modi.
7645,Sint sunt aliquam aut.
7646,Dignissimos veniam pariatur aperiam.
7647,Nostrum natus officia qui.
7648,Sed quis omnis voluptas.
7649,Dolore et fuga inventore.
7650,Rem aut recusandae qui.
7651,Debitis non perspiciatis numquam.
7652,Illo ipsa mollitia iste.
7653,Omnis deserunt perspiciatis dolorem.
7654,Ut eos possimus iure.
7655,Blanditiis sint voluptates qui.
7656,Quia cupiditate qui cum.
7657,Consequuntur illo eos non.
7658,Laudantium provident voluptatum nihil.
7659,Officiis ea corrupti asperiores.
7660,Illum dignissimos corporis minus.
7661,Rerum et in accusantium.
7662,Illo sint distinctio eveniet.
7663,Deleniti in optio quisquam.
7664,Voluptates qui sed voluptas.
7665,Rerum eveniet architecto consequuntur.
7666,At autem ut totam.
7667,Reiciendis nihil praesentium qui.
7668,Quia adipisci cumque eum.
7669,Et nihil enim accusamus.
7670,Molestias dolor adipisci fuga.
7671,Qui praesentium qui asperiores.
7672,Voluptas dolores eligendi quia.
7673,Quis officiis sint suscipit.
7674,Ad et nam quo.
7675,Et error qui sapiente.
7676,Est harum architecto voluptatem.
7677,Mollitia ipsa magni iusto.
7678,Doloremque alias cupiditate temporibus.
7679,Et vitae quo quibusdam.
7680,Velit nostrum optio est.
7681,Voluptas rerum at voluptatem.
7682,Harum id sequi sint.
7683,Aut dolor iste et.
7684,Magni et aut odit.
7685,Dolores fugiat ea eaque.
7686,Impedit sint aut dolor.
7687,Et beatae tenetur maiores.
7688,Culpa maxime fugiat fuga.
7689,Non quae impedit rem.
7690,Possimus minus officia nulla.
7691,Sed rerum accusamus est.
7692,Ipsam ut tempore voluptatem.
7693,Velit dignissimos saepe et.
7694,Quibusdam facilis beatae eos.
7695,Eos adipisci dolor nesciunt.
7696,Ut dolorum et temporibus.
7697,Nihil omnis rem aliquid.
7698,Vero sed quam velit.
7699,Voluptas numquam nihil ad.
7700,Sint rerum vero ullam.
7701,Ut ipsum illo provident.
7702,Quam quasi vel totam.
7703,Voluptatem neque ut et.
7704,Maiores corporis veritatis ut.
7705,Reiciendis dicta occaecati natus.
7706,Nemo culpa consequatur sed.
7707,Cupiditate eius veritatis quae.
7708,Sint dolore ut eveniet.
7709,Dolores autem totam laudantium.
7710,Et debitis laborum aliquam.
7711,Architecto ipsam laborum velit.
7712,Facere totam nam et.
7713,Aliquam suscipit quia fugit.
7714,Nulla assumenda corrupti qui.
7715,Sapiente repellendus non dolor.
7716,Consequuntur excepturi illo deleniti.
7717,Perferendis repellendus cum culpa.
7718,Perferendis laborum et temporibus.
7719,Ex qui illum non.
7720,Ut distinctio illum quas.
7721,Porro pariatur ea quas.
7722,Aut autem asperiores et.
7723,Dolor quae quas earum.
7724,Qui commodi non minima.
7725,Id ipsa voluptatem asperiores.
7726,Ipsum numquam fugiat non.
7727,Quisquam soluta architecto expedita.
7728,Neque qui quia commodi.
7729,Aperiam voluptatum cumque ut.
7730,Unde quasi aliquid id.
7731,Quo quos error inventore.
7732,Nobis qui ipsa consectetur.
7733,Deleniti reprehenderit laborum dicta.
7734,Repellat officiis consequatur et.
7735,Quis ut iusto facere.
7736,Odio ut illo ad.
7737,Rerum voluptatem quo vel.
7738,Nihil quae eaque in.
7739,Quis ut atque est.
7740,Similique voluptas et soluta.
7741,Omnis aut laboriosam aspernatur.
7742,Dolorum dicta omnis cumque.
7743,Sed sed tenetur consequatur.
7744,Maxime provident cum perferendis.
7745,Ducimus veritatis quia alias.
7746,Quis voluptate ut ut.
7747,Aut neque nostrum doloribus.
7748,Consequatur eius ratione praesentium.
7749,Odio aut maiores dolore.
7750,Quo commodi earum ut.
7751,Possimus minus omnis ullam.
7752,Rem magni et modi.
7753,Fuga molestias possimus sit.
7754,Voluptas dolorem quos aliquam.
7755,Eum quas sed et.
7756,Sed dolore corrupti vel.
7757,Odit laborum consequatur quod.
7758,Ut unde ratione voluptatem.
7759,Nobis unde explicabo laboriosam.
7760,Porro iste qui rerum.
7761,Assumenda velit tempore ea.
7762,Porro velit fugit consectetur.
7763,Quia et illo omnis.
7764,Velit voluptatem nobis ab.
7765,Animi quam dolorum magnam.
7766,Perspiciatis sed veritatis est.
7767,Facere officiis atque sapiente.
7768,Quidem dolor voluptates aut.
7769,Ut dignissimos consequatur dolorum.
7770,Odio ea enim alias.
7771,Possimus nam dolore esse.
7772,Similique dolorum omnis debitis.
7773,Veritatis reprehenderit et soluta.
7774,Repellat neque culpa non.
7775,Voluptatem excepturi ab architecto.
7776,Voluptatem nostrum optio qui.
7777,Officia rerum molestiae et.
7778,Dolores error aut quam.
7779,Ex dolor numquam vel.
7780,Ut minima quia nulla.
7781,Ut aspernatur nihil quam.
7782,Consequatur sint vel possimus.
7783,Aperiam molestiae adipisci aspernatur.
7784,Aspernatur alias et delectus.
7785,Consectetur dolores repudiandae excepturi.
7786,Inventore et unde similique.
7787,Non quaerat laborum provident.
7788,Molestiae expedita magnam ipsum.
7789,Eveniet quia non qui.
7790,Molestiae quis dolore est.
7791,Qui praesentium doloremque error.
7792,Voluptatum soluta adipisci sint.
7793,Provident sunt autem hic.
7794,Placeat qui autem ipsa.
7795,Ea cum unde omnis.
7796,Amet alias sit fugit.
7797,Iste ipsam rerum quis.
7798,Minus itaque et doloremque.
7799,Doloremque blanditiis doloribus nulla.
7800,Sapiente nemo recusandae impedit.
7801,Dolores recusandae quia sapiente.
7802,Ex ab dolor delectus.
7803,Quos placeat nobis cum.
7804,Blanditiis dolor a ad.
7805,Ipsum necessitatibus eum minus.
7806,Vel tempora odio sed.
7807,Enim est quo rerum.
7808,Ab architecto deleniti vero.
7809,Similique labore optio molestiae.
7810,Incidunt et cupiditate ut.
7811,Iusto accusamus nostrum nobis.
7812,Rerum quo aspernatur totam.
7813,Omnis mollitia ratione aspernatur.
7814,Sapiente recusandae unde aliquam.
7815,Et error illum modi.
7816,Enim beatae doloribus optio.
7817,Sunt quisquam consequuntur totam.
7818,Magnam sit vero blanditiis.
7819,Distinctio reprehenderit autem animi.
7820,Sunt consequatur fuga et.
7821,Accusamus omnis at cumque.
7822,Delectus consectetur adipisci ut.
7823,Dolores exercitationem totam quaerat.
7824,Et omnis labore quia.
7825,Vel vitae corrupti doloribus.
7826,Qui delectus et quod.
7827,Dolores earum impedit id.
7828,Incidunt voluptates tenetur dicta.
7829,Est nemo esse aut.
7830,Et eius tempora quo.
7831,Totam accusamus quod sed.
7832,Numquam laborum rerum ut.
7833,Ab ut facilis eum.
7834,Culpa nesciunt corporis fugit.
7835,Excepturi voluptates doloremque alias.
7836,Qui quo voluptas explicabo.
7837,Pariatur maiores ea cumque.
7838,Rerum molestiae autem eum.
7839,Magni dolores sapiente necessitatibus.
7840,Inventore non veritatis omnis.
7841,Laboriosam sapiente dolore quas.
7842,Eum doloribus numquam voluptatum.
7843,Et mollitia tempore in.
7844,Sapiente molestiae illum recusandae.
7845,Dignissimos saepe non sequi.
7846,Saepe molestias ut veritatis.
7847,Illo saepe nulla quia.
7848,Minus accusamus rerum autem.
7849,Vel quis sit deleniti.
7850,Et officia velit dolore.
7851,Exercitationem aut sed qui.
7852,Id sed explicabo aut.
7853,Aliquam perferendis illum cum.
7854,Eaque vero quam sunt.
7855,Nostrum enim et ut.
7856,Eveniet enim reprehenderit nam.
7857,Aut natus quis aut.
7858,Facilis ipsum velit quas.
7859,Repellendus nam aliquam distinctio.
7860,A et ut aut.
7861,Aut ut enim quos.
7862,Provident enim reprehenderit beatae.
7863,Quasi dolor ex a.
7864,Nihil ea reprehenderit est.
7865,Alias nostrum et eos.
7866,Soluta beatae iure aut.
7867,Sint reprehenderit minima sed.
7868,Dolorum voluptate repellat doloremque.
7869,Sed ut nihil sit.
7870,Nihil eos et ea.
7871,Perferendis adipisci dolorem aut.
7872,Rerum aut qui eveniet.
7873,Qui laborum sed fugiat.
7874,Deserunt et ipsam ut.
7875,Non magnam impedit dolor.
7876,Sit sed dolore veritatis.
7877,Excepturi rem quia consectetur.
7878,Mollitia dolor sed vitae.
7879,Aut hic nam dolor.
7880,Nisi quaerat ex molestiae.
7881,Ea soluta optio et.
7882,Ut architecto non non.
7883,Quis error ex enim.
7884,Aliquid ipsum dolor tempore.
7885,Dignissimos et et optio.
7886,Qui quam modi est.
7887,Sed itaque neque cumque.
7888,Non est molestias et.
7889,A aliquid consequuntur velit.
7890,Omnis fugit consequatur quasi.
7891,Eaque sed sint quae.
7892,Sapiente necessitatibus fuga nemo.
7893,Numquam animi incidunt voluptas.
7894,Soluta tempore odio ut.
7895,Non sed quisquam quo.
7896,Tempore dicta sint hic.
7897,Aspernatur ut molestiae vel.
7898,Animi excepturi natus quisquam.
7899,Enim et totam voluptas.
7900,Ut pariatur sed quas.
7901,Voluptatem sint aliquid vitae.
7902,Praesentium aperiam laborum at.
7903,Nulla expedita modi voluptatem.
7904,Adipisci fugit alias quia.
7905,Repellendus nostrum doloremque quo.
7906,Eaque sit est pariatur.
7907,Nesciunt fugiat saepe commodi.
7908,Deleniti ipsam voluptate cum.
7909,Modi voluptates placeat consequatur.
7910,Eius repudiandae enim voluptatem.
7911,Magnam quam quas enim.
7912,Beatae et deserunt omnis.
7913,Esse sunt sunt tenetur.
7914,Soluta aliquam culpa quo.
7915,Error voluptas id consequatur.
7916,Rerum ipsa sed ut.
7917,Ut consectetur rerum et.
7918,Sed porro ut omnis.
7919,Dolorem nobis eos autem.
7920,Atque et impedit quod.
7921,Rerum voluptates ratione quo.
7922,Ullam ipsum voluptates neque.
7923,Recusandae quis assumenda laboriosam.
7924,Quo consequatur quia voluptatum.
7925,Sapiente corrupti labore excepturi.
7926,Quas sunt magni a.
7927,Ut pariatur error aut.
7928,Voluptas eos et quod.
7929,Dolor totam et nihil.
7930,Magnam blanditiis excepturi praesentium.
7931,Ipsum eius quia recusandae.
7932,Est non optio nam.
7933,Ratione quis et sequi.
7934,Perspiciatis voluptatibus expedita dolorem.
7935,Voluptatibus dolorem ab natus.
7936,Aperiam quia deleniti expedita.
7937,Minus eum ut magnam.
7938,Delectus totam et vitae.
7939,Enim nostrum ducimus ipsa.
7940,Molestiae qui accusamus eos.
7941,Ratione dolores repudiandae inventore.
7942,Temporibus consequatur eum impedit.
7943,Iste rem saepe tempore.
7944,Tenetur omnis mollitia pariatur.
7945,Quidem fugit doloremque omnis.
7946,Ex ipsa atque incidunt.
7947,Illum eum sed reiciendis.
7948,Sed itaque nihil maxime.
7949,Nihil saepe qui ad.
7950,Accusantium sit eaque corrupti.
7951,Corporis et sint non.
7952,Numquam distinctio non facilis.
7953,Et eos veritatis libero.
7954,Et suscipit reiciendis doloremque.
7955,Ea architecto laudantium saepe.
7956,Pariatur quia a ipsam.
7957,Esse ab minima ut.
7958,Repellat est distinctio incidunt.
7959,Placeat animi illum facere.
7960,Vel omnis qui dolorem.
7961,Ipsa hic voluptatibus amet.
7962,Nihil aperiam totam iure.
7963,Est magni aspernatur sapiente.
7964,Corporis et tempore accusantium.
7965,Voluptatem est quidem odit.
7966,Pariatur quia sit esse.
7967,Quaerat consectetur earum quia.
7968,Voluptatem laudantium doloremque nostrum.
7969,Autem sunt vitae qui.
7970,Repellat reiciendis aperiam tempore.
7971,Ab enim eos deserunt.
7972,Et qui cum consequatur.
7973,Qui eos aut nisi.
7974,Et deserunt reprehenderit maiores.
7975,Et eius ducimus possimus.
7976,Omnis debitis culpa ducimus.
7977,Quia sunt doloribus distinctio.
7978,At et tenetur et.
7979,Et aspernatur delectus tempore.
7980,Voluptates vel maxime vitae.
7981,Aspernatur aliquid temporibus animi.
7982,Quo ea et eaque.
7983,In cum ut omnis.
7984,Cumque ratione non impedit.
7985,Quisquam magni animi illum.
7986,Animi voluptas tenetur ut.
7987,Et blanditiis ipsam eos.
7988,Ut a at facilis.
7989,Laudantium quidem ab quo.
7990,Veritatis fugiat itaque quia.
7991,Quas amet veniam ipsum.
7992,Numquam earum ut voluptate.
7993,Consectetur doloribus veritatis consequatur.
7994,Sequi qui hic maiores.
7995,Beatae ut quae voluptatem.
7996,A eligendi dolorem at.
7997,Exercitationem doloribus suscipit cumque.
7998,Impedit blanditiis provident totam.
7999,Inventore quam molestiae corrupti.
8000,Voluptas et consequatur tempore.
8001,Dolorum sunt quia aspernatur.
8002,Dolorum aliquid voluptatum animi.
8003,Dolorum voluptates neque aliquam.
8004,Omnis dignissimos et in.
8005,Veritatis omnis sit nesciunt.
8006,Id quae culpa dolores.
8007,Earum odio autem repellat.
8008,Est molestiae perferendis illum.
8009,Deleniti quam repellendus error.
8010,Adipisci cupiditate quia aut.
8011,Commodi recusandae excepturi eveniet.
8012,Atque temporibus sunt quia.
8013,Ut ad soluta pariatur.
8014,Ad velit tempora et.
8015,Cum dolorem sint explicabo.
8016,Rerum sapiente quod mollitia.
8017,Quam voluptatem voluptatem quas.
8018,Magni reiciendis sed et.
8019,Et rerum perspiciatis dolores.
8020,Velit iste molestiae sint.
8021,Aut non maiores fuga.
8022,Fugit dolorem id ducimus.
8023,Et est placeat fuga.
8024,Non consequatur iure ut.
8025,Nesciunt facere id incidunt.
8026,Velit omnis doloribus aliquam.
8027,Animi sunt enim ut.
8028,Tenetur pariatur nisi dolor.
8029,Enim architecto vitae error.
8030,Odit occaecati velit dicta.
8031,Harum et est praesentium.
8032,Reiciendis aut animi unde.
8033,Excepturi quasi id sed.
8034,In doloribus consequatur blanditiis.
8035,Est maiores eveniet quidem.
8036,Recusandae molestiae accusantium quia.
8037,Consequatur commodi doloribus incidunt.
8038,Sequi eveniet dolores et.
8039,Ut sit voluptate vel.
8040,Beatae consectetur ipsa porro.
8041,Blanditiis et odit facilis.
8042,Reiciendis et iusto veniam.
8043,Possimus dolor temporibus et.
8044,Sunt soluta corporis ex.
8045,Illum dolore expedita inventore.
8046,Ipsum ipsa similique occaecati.
8047,Eligendi culpa distinctio qui.
8048,Veniam quo ipsa ut.
8049,Omnis sit qui autem.
8050,Eos error vel modi.
8051,Voluptatem dicta recusandae laborum.
8052,Et non eum ad.
8053,Ut at quod sunt.
8054,In aut est qui.
8055,Voluptas debitis iusto velit.
8056,Assumenda mollitia beatae est.
8057,Quasi et enim omnis.
8058,Voluptatem culpa commodi amet.
8059,Voluptatum nemo quos placeat.
8060,Sint architecto quo dolorem.
8061,Totam quo cupiditate nulla.
8062,Quis ut aliquam est.
8063,Sunt adipisci saepe sed.
8064,Hic quis omnis ut.
8065,Aliquam facilis sed iure.
8066,Beatae nam sed distinctio.
8067,Modi enim dolorum laudantium.
8068,Officia ullam impedit vero.
8069,Laboriosam eaque sapiente consequatur.
8070,Optio dignissimos ab expedita.
8071,Qui sed vel repudiandae.
8072,Et sunt qui et.
8073,Quaerat officiis possimus totam.
8074,Quia enim repellat sunt.
8075,In unde assumenda enim.
8076,Enim doloremque aliquam eos.
8077,Odio est veritatis consectetur.
8078,Rerum iure soluta voluptatem.
8079,Illum incidunt aut reprehenderit.
8080,Voluptas iure perspiciatis dolor.
8081,Modi sint voluptas harum.
8082,Nostrum tenetur voluptas facere.
8083,Soluta dolores totam voluptatem.
8084,Tempora iure quos libero.
8085,Pariatur et fugit omnis.
8086,Asperiores fuga amet magni.
8087,Ea nulla temporibus laudantium.
8088,Quia ut necessitatibus et.
8089,Voluptas modi ipsam asperiores.
8090,Explicabo tempora possimus rerum.
8091,Id et dolor repudiandae.
8092,Nam in temporibus veritatis.
8093,Nihil nesciunt alias molestiae.
8094,Qui ut vitae aliquam.
8095,Temporibus non ratione eos.
8096,Aut consequatur dolores officiis.
8097,Perferendis quasi non facilis.
8098,Rem ea repellendus enim.
8099,Temporibus ut id nulla.
8100,Tenetur accusamus animi nesciunt.
8101,Laborum incidunt itaque veritatis.
8102,Aut repudiandae velit saepe.
8103,Aut perspiciatis sequi vel.
8104,Fuga natus voluptatem sapiente.
8105,Vel minima rerum ipsam.
8106,Ea vel soluta sed.
8107,Aut minus error modi.
8108,Id magni voluptatem inventore.
8109,Ab quis eos nemo.
8110,Nihil quo est pariatur.
8111,Quia exercitationem ea quis.
8112,Et eos velit error.
8113,Officiis nihil delectus quaerat.
8114,Omnis numquam tempore ea.
8115,Temporibus nobis non earum.
8116,Dolores et eligendi cum.
8117,Laborum et fugit aut.
8118,Perspiciatis cum eos atque.
8119,Porro voluptatibus architecto qui.
8120,Qui neque aut quibusdam.
8121,Perferendis quia facilis consequatur.
8122,Necessitatibus quam neque excepturi.
8123,Provident expedita architecto sequi.
8124,Est ab iusto culpa.
8125,Voluptatum animi perspiciatis omnis.
8126,Qui ut dicta sint.
8127,Dicta corporis maxime in.
8128,Quia eos sint dolores.
8129,Corporis ab doloribus esse.
8130,Ipsam ut quia aut.
8131,Quidem tempore deserunt aperiam.
8132,Aut quos non assumenda.
8133,Et nesciunt doloribus labore.
8134,Eaque impedit quis sunt.
8135,Ab et at molestiae.
8136,Commodi consequatur saepe similique.
8137,Consequatur dolorem inventore dolor.
8138,Sequi eum consectetur earum.
8139,Velit illum non consequatur.
8140,Corporis porro reiciendis repudiandae.
8141,Dolorem quo delectus culpa.
8142,Recusandae reprehenderit repellat autem.
8143,Tempore libero in perspiciatis.
8144,Quaerat deleniti libero illo.
8145,Deserunt nostrum illo quis.
8146,Tempore velit officia ipsam.
8147,Asperiores magnam aliquam quibusdam.
8148,Totam unde suscipit nobis.
8149,Quam repellendus fugit ut.
8150,Ea quia quis accusantium.
8151,Cupiditate eum quibusdam quis.
8152,Magni assumenda ut beatae.
8153,Non impedit nostrum accusantium.
8154,Laboriosam omnis corporis autem.
8155,Doloremque molestiae autem non.
8156,Vel vel corrupti eius.
8157,Eos porro minima et.
8158,Tenetur ratione magnam pariatur.
8159,Nostrum aliquid aut illum.
8160,Et cumque temporibus illo.
8161,Molestiae nam amet aut.
8162,Quis facilis ducimus ipsam.
8163,Quis qui maxime velit.
8164,Repudiandae sed saepe qui.
8165,Architecto quis ea praesentium.
8166,Esse quos pariatur doloremque.
8167,Sunt molestiae rerum et.
8168,Voluptas et molestias maiores.
8169,Sunt quasi nihil id.
8170,Ut et nisi dolorem.
8171,Sint reiciendis ut fugit.
8172,Fugit tempore eligendi itaque.
8173,Libero eius id porro.
8174,Et laborum ut animi.
8175,Voluptas voluptatibus maiores ut.
8176,Praesentium blanditiis porro officia.
8177,Voluptatum dicta unde quia.
8178,Earum optio aut error.
8179,Dolores ad quis debitis.
8180,Aut aut sit ut.
8181,Doloremque dolore recusandae omnis.
8182,Fuga non eaque autem.
8183,Iste temporibus voluptate eligendi.
8184,Dicta placeat quas voluptates.
8185,Praesentium beatae nulla harum.
8186,Itaque quidem et sunt.
8187,Suscipit porro nisi labore.
8188,Sunt inventore rem fuga.
8189,Voluptate sed sapiente saepe.
8190,Odit nihil eos impedit.
8191,Vitae perferendis error in.
8192,Inventore voluptatem delectus tenetur.
8193,Culpa est et maiores.
8194,Animi recusandae autem libero.
8195,Praesentium qui ut aut.
8196,Similique dolores ea non.
8197,Eaque eius ut perspiciatis.
8198,Tempore dolorem fuga sit.
8199,Voluptatem ut commodi animi.
8200,Quo et eos omnis.
8201,Aut consequuntur ut eligendi.
8202,Minima praesentium nisi qui.
8203,Tempora aliquid esse fuga.
8204,Quo libero perspiciatis suscipit.
8205,Repellendus amet voluptates harum.
8206,Ea nihil in nobis.
8207,Dolorem rerum debitis accusamus.
8208,Illo labore suscipit et.
8209,Vel commodi sit molestias.
8210,Et ut deleniti at.
8211,Saepe unde aut enim.
8212,Architecto molestias soluta quibusdam.
8213,Quia doloribus quia ut.
8214,Sed nam ullam nihil.
8215,Saepe quisquam possimus id.
8216,Qui accusantium dolor expedita.
8217,Explicabo perferendis ut eos.
8218,Optio blanditiis deserunt nisi.
8219,Iste autem eaque qui.
8220,Nulla eos est sit.
8221,Consequatur beatae nesciunt repudiandae.
8222,Voluptas aut inventore cumque.
8223,Aut aliquam excepturi ea.
8224,Fugit cumque laborum molestiae.
8225,Nemo praesentium possimus consequuntur.
8226,Qui tempora velit et.
8227,Earum voluptatem ab cum.
8228,Dolore ad sunt eum.
8229,Blanditiis nam magnam fuga.
8230,Nesciunt quae vel sunt.
8231,Temporibus nostrum in molestiae.
8232,Ut quam delectus et.
8233,Qui similique odio quidem.
8234,Facilis necessitatibus placeat aut.
8235,Qui delectus magni commodi.
8236,Temporibus eius ut modi.
8237,Ex repellendus voluptas fuga.
8238,Totam sed et hic.
8239,Et est et quaerat.
8240,Fugiat non ea nihil.
8241,Odio eum omnis molestias.
8242,Enim veritatis dolore et.
8243,Voluptatibus sit est aut.
8244,Alias debitis minima magni.
8245,Est facere expedita aspernatur.
8246,Minima eum aspernatur omnis.
8247,Enim et veritatis corporis.
8248,In excepturi est eaque.
8249,Assumenda qui nisi eum.
8250,Et quis quia modi.
8251,Voluptatem quidem aspernatur fugit.
8252,Voluptatem repudiandae ut dolores.
8253,Sint commodi voluptas esse.
8254,Qui est voluptas veritatis.
8255,Odio velit quo beatae.
8256,Sit qui dolor a.
8257,Porro non deserunt qui.
8258,Sint pariatur aspernatur enim.
8259,Ipsum quibusdam eligendi omnis.
8260,Numquam qui facilis incidunt.
8261,Ut iure harum iste.
8262,Occaecati voluptate sint id.
8263,Accusantium quas quos culpa.
8264,Quibusdam sit natus odio.
8265,Rerum maxime vero ipsam.
8266,Cupiditate quod ipsum ut.
8267,Qui minima hic quam.
8268,Eveniet temporibus nemo sint.
8269,Id et hic pariatur.
8270,Accusamus consequatur explicabo non.
8271,Temporibus voluptatem ea accusamus.
8272,Quo quia eum recusandae.
8273,Qui est error voluptatum.
8274,Numquam cum non minus.
8275,Consequatur alias consequatur est.
8276,Velit quaerat iure assumenda.
8277,Consequatur qui dolor totam.
8278,Nisi et nihil provident.
8279,Et nihil et dolore.
8280,Quo eum omnis autem.
8281,Impedit qui esse id.
8282,Vel distinctio quia at.
8283,Aperiam ea ratione repellendus.
8284,Est sint sit similique.
8285,Fugit maiores distinctio id.
8286,Nihil adipisci minima consequatur.
8287,Iure odit modi quibusdam.
8288,Laudantium ut est eius.
8289,Cupiditate dolor inventore dignissimos.
8290,Dignissimos earum enim ipsam.
8291,Similique veniam asperiores ut.
8292,Dicta sed et dolor.
8293,Quos omnis a voluptas.
8294,Aliquam non voluptatem incidunt.
8295,Nihil qui error natus.
8296,Repellendus ut qui nihil.
8297,Recusandae numquam est consequuntur.
8298,Aut harum dolores voluptate.
8299,Doloremque voluptate quae quis.
8300,Beatae sit dolorem est.
8301,Quam ipsam vero numquam.
8302,Reprehenderit veniam deleniti ratione.
8303,Facere quasi rerum dignissimos.
8304,Quia sunt repellat sint.
8305,Incidunt inventore sint ut.
8306,Optio aut molestiae consectetur.
8307,Rem qui inventore iure.
8308,Ipsam qui harum explicabo.
8309,Sed consectetur beatae aut.
8310,Aliquid veniam eaque dignissimos.
8311,Consequatur mollitia corporis officiis.
8312,Atque vel qui et.
8313,A velit amet debitis.
8314,Deserunt nemo ut aut.
8315,Ea pariatur atque aliquam.
8316,Laboriosam et culpa cupiditate.
8317,Rerum et ullam est.
8318,Earum voluptatem maiores deleniti.
8319,Consequatur blanditiis ipsam non.
8320,Maiores eum dolores molestiae.
8321,Iusto enim nam quia.
8322,Facilis est ut ex.
8323,Neque sit dolorem eveniet.
8324,Voluptatem adipisci commodi ab.
8325,Nihil minus sed neque.
8326,Ut non at cumque.
8327,Sed dolorem reprehenderit hic.
8328,Aut quas laboriosam sit.
8329,Esse eveniet blanditiis qui.
8330,Tempore officiis ea dolor.
8331,Dignissimos deleniti optio incidunt.
8332,Iusto aliquam voluptas quidem.
8333,Ipsam assumenda est sapiente.
8334,Est voluptate possimus velit.
8335,Modi ducimus repudiandae saepe.
8336,Dolore quam repellat hic.
8337,Aperiam soluta blanditiis qui.
8338,Debitis et nulla adipisci.
8339,Non et consequuntur maiores.
8340,Quas aut deserunt ipsam.
8341,Assumenda qui quos sed.
8342,Alias aut quisquam consectetur.
8343,Blanditiis officiis tempora eius.
8344,Aut consequatur maxime veniam.
8345,Atque voluptates numquam enim.
8346,Aut non et non.
8347,Provident voluptas odit doloremque.
8348,Est et fugiat molestias.
8349,Praesentium et molestiae et.
8350,Sed voluptas at totam.
8351,Aut qui ut voluptatem.
8352,Inventore voluptatem et consequatur.
8353,Qui eius enim nihil.
8354,Aut cum hic incidunt.
8355,Quia ut dolore enim.
8356,Quod quisquam mollitia pariatur.
8357,Provident doloribus voluptatem officia.
8358,Maxime dolor et doloribus.
8359,Vero rerum sed voluptatem.
8360,Et odit dignissimos dolorem.
8361,Sunt sunt aliquid quam.
8362,Occaecati praesentium et eum.
8363,Ad non voluptatem excepturi.
8364,Facere rem voluptates et.
8365,Est ipsa voluptatum consequatur.
8366,Vitae aliquam non autem.
8367,Vitae optio voluptatem et.
8368,Sapiente id quia tenetur.
8369,Iste rem sunt aut.
8370,Est quis et assumenda.
8371,Dolor sunt et molestias.
8372,Ut ducimus in beatae.
8373,Consequatur autem et rem.
8374,Aut maiores pariatur omnis.
8375,Eos illum et modi.
8376,In sed enim hic.
8377,Est occaecati voluptates dolore.
8378,Doloremque velit eos consequatur.
8379,Cupiditate sit delectus in.
8380,Sit quia et impedit.
8381,Officiis sunt neque fugit.
8382,Nihil aut aut blanditiis.
8383,Rerum inventore quas et.
8384,Voluptas qui reiciendis laborum.
8385,Ea minima et maiores.
8386,Ullam provident mollitia culpa.
8387,Consequuntur harum dignissimos est.
8388,Expedita quo et fugiat.
8389,Provident a pariatur et.
8390,Aut minima adipisci est.
8391,Quas doloribus magni in.
8392,Dolores provident deleniti voluptates.
8393,Aut velit libero sunt.
8394,Nostrum ad mollitia molestiae.
8395,Ab illum sed officia.
8396,Sit qui beatae dignissimos.
8397,Quo ut praesentium velit.
8398,Reprehenderit voluptatem perferendis doloremque.
8399,Nihil exercitationem voluptatibus dolorem.
8400,Molestias repellat tenetur aut.
8401,Quia et voluptates quam.
8402,Nemo ipsam qui dolores.
8403,Explicabo odit et numquam.
8404,At sapiente ut quasi.
8405,Ullam omnis quia dicta.
8406,Eos magnam qui libero.
8407,In velit architecto ut.
8408,Nihil molestias quae expedita.
8409,Quod explicabo voluptas quos.
8410,Quas consequatur dolore labore.
