recipe_id,note_descript
1,Id adipisci omnis in.
2,Sunt consequatur ut distinctio.
3,Doloribus deserunt quis excepturi.
4,Tenetur aliquam qui voluptatibus.
5,Dolorum sed cum nisi.
6,Dolore qui porro odio.
7,Soluta nostrum non impedit.
8,Voluptate nesciunt consectetur molestiae.
9,Rerum deleniti sed nisi.
10,Pariatur ea dolore voluptatem.
11,Veritatis rem sit omnis.
12,Ex architecto qui consequatur.
13,Autem ut ea est.
14,Eligendi omnis aut vel.
15,Culpa eos ut ea.
16,Voluptas totam eum beatae.
17,Qui temporibus libero quasi.
18,Occaecati consequuntur aliquam porro.
19,Excepturi sit ipsam sunt.
20,Et quis qui repudiandae.
21,Quis praesentium ut eius.
22,Exercitationem suscipit asperiores tenetur.
23,Expedita ab facilis unde.
24,Nemo molestiae autem minus.
25,Reiciendis facilis nam non.
26,Minus eius quia debitis.
27,Sint dignissimos et repellendus.
28,In quia aut quas.
29,Similique est consequatur officiis.
30,Qui nulla eius ipsam.
31,Enim consequatur reprehenderit ducimus.
32,Officia beatae totam rerum.
33,Quas enim nostrum occaecati.
34,Laborum quasi officiis ut.
35,Aut dolorum earum soluta.
36,Dolor minima nihil delectus.
37,Voluptas non ut nihil.
38,Aperiam ut aut optio.
39,Ea aspernatur debitis eaque.
40,Maxime libero ipsum ab.
41,Dolores ex quia commodi.
42,Molestiae est aut voluptate.
43,Ducimus quaerat quam et.
44,Sapiente repellat molestiae molestias.
45,Temporibus iusto praesentium dolorem.
46,Natus officiis reiciendis consequatur.
47,Sit alias soluta voluptatem.
48,Alias quaerat molestias nisi.
49,Aut vel qui nemo.
50,Deserunt ut cumque dignissimos.
51,Et quis repellendus iusto.
52,Harum velit laborum quia.
53,Aut ad nobis beatae.
54,Saepe rerum praesentium optio.
55,Eos et quas ullam.
56,Iste sed sit quidem.
57,Tempore tenetur odit iure.
58,Laudantium id et quo.
59,Sed provident aut voluptas.
60,Alias temporibus dolores est.
61,Ratione distinctio voluptas quod.
62,Doloremque nihil qui animi.
63,Commodi omnis sit eos.
64,Sit omnis fugiat minima.
65,Corrupti error reiciendis non.
66,Qui ipsum commodi adipisci.
67,Dolorem cumque consequatur assumenda.
68,Eum aut nobis et.
69,Debitis sequi totam numquam.
70,Ipsum et quas consequatur.
71,Libero dolores quia doloribus.
72,Rem at molestias esse.
73,Nihil sunt perferendis et.
74,Minus quis nostrum incidunt.
75,Itaque dolor et saepe.
76,Ut ipsam omnis sed.
77,Corrupti dignissimos dolor quo.
78,Qui nulla molestiae voluptatem.
79,Assumenda consequatur minima officiis.
80,At aut qui sunt.
81,Vel aut sed ut.
82,Voluptates eos nostrum dolore.
83,Explicabo nemo dolore omnis.
84,Ut voluptatibus mollitia quis.
85,Tempore possimus dolor maxime.
86,Illo sit vel omnis.
87,Aspernatur explicabo perferendis sit.
88,Dolore non repudiandae et.
89,Autem porro ipsum alias.
90,Molestias non sed est.
91,Quis distinctio iure fuga.
92,Sed commodi natus omnis.
93,Ipsum nam ut cum.
94,Ullam repellat et expedita.
95,Ratione at enim non.
96,Aut earum molestiae sunt.
97,Quis inventore ut nihil.
98,Mollitia aut necessitatibus magni.
99,Soluta veritatis aut iste.
100,Consectetur corporis ut aut.
101,Laboriosam ex quia dolores.
102,Laudantium omnis quas reprehenderit.
103,Eveniet dolores quo ut.
104,Fugit ut dolorem praesentium.
105,Sit voluptatem deserunt corrupti.
106,Quis a assumenda aliquid.
107,Et est velit veniam.
108,Cum quis ut nisi.
109,Illo qui voluptas autem.
110,Qui ex unde pariatur.
111,Maxime laudantium fugiat aliquam.
112,Quo deleniti est qui.
113,Non quidem distinctio non.
114,Quaerat odio quae eum.
115,Maiores consequatur dolores autem.
116,Vel quis ullam iure.
117,Aut libero voluptas vel.
118,Eos porro corrupti deserunt.
119,Et nisi et consequatur.
120,Saepe qui repellendus inventore.
121,Enim eveniet expedita tempora.
122,Est et perspiciatis vero.
123,Qui quas velit error.
124,Ratione facere natus possimus.
125,Voluptatum repudiandae iusto illo.
126,Perspiciatis et et distinctio.
127,Omnis non dolorem molestias.
128,Laborum dolore quis et.
129,Corrupti dolor ipsum et.
130,Ab eveniet omnis ducimus.
131,Velit animi perferendis voluptas.
132,Hic dolores ea id.
133,Voluptas consequatur dicta omnis.
134,Et a quibusdam consequuntur.
135,Reiciendis incidunt eveniet maxime.
136,Et reiciendis consequatur eos.
137,Tenetur dicta consequatur earum.
138,Maiores omnis esse et.
139,Facilis optio hic nostrum.
140,Ullam blanditiis rerum repudiandae.
141,Sit blanditiis dolorem quia.
142,Autem nostrum corporis ducimus.
143,Sint cumque iusto optio.
144,Veritatis neque voluptatem perspiciatis.
145,Amet est est mollitia.
146,Ut magni qui ab.
147,Et dolores ut nostrum.
148,Officiis voluptate commodi at.
149,Dignissimos atque occaecati repudiandae.
150,Et non id temporibus.
151,Eligendi doloremque provident porro.
152,Porro qui quisquam alias.
153,Dolor et itaque asperiores.
154,Necessitatibus a eaque ut.
155,Et cum totam et.
156,Quaerat illum vero in.
157,Iste saepe est sint.
158,Quisquam quae quis reprehenderit.
159,Enim ut eveniet eius.
160,Nemo vero ea quo.
161,Occaecati maiores tempore ducimus.
162,Exercitationem dolorum asperiores est.
163,Distinctio quidem nihil quo.
164,Repellendus tenetur officiis provident.
165,Consectetur dolorem itaque molestias.
166,Rerum quia tenetur est.
167,Rerum voluptatem cum quae.
168,Consequatur nihil odit non.
169,Quia vel quod corporis.
170,Fuga ad et veniam.
171,Ratione dolores ab aut.
172,Cum praesentium omnis nisi.
173,Repellat omnis et error.
174,Quibusdam et qui laboriosam.
175,Delectus consequuntur error ullam.
176,Earum totam consequuntur ducimus.
177,Accusantium aspernatur et laboriosam.
178,Impedit aperiam aut saepe.
179,Voluptatem dolorum voluptas facilis.
180,Quis est dolor quia.
181,Omnis dolorum eligendi autem.
182,Aspernatur ea qui enim.
183,Hic qui facilis atque.
184,Aspernatur omnis voluptatem officia.
185,Qui aut et quo.
186,Adipisci dolores doloribus ipsam.
187,Nam ut et doloremque.
188,Velit aut praesentium cupiditate.
189,Delectus odio commodi distinctio.
190,Quisquam accusantium voluptates molestias.
191,Eaque vel non natus.
192,Nostrum ab iure nulla.
193,Dicta quod est beatae.
194,Repellendus accusantium fugiat et.
195,Quas qui harum id.
196,Saepe quasi iste maiores.
197,Ipsam optio dicta iure.
198,Nihil dolore asperiores fugit.
199,Et ab voluptates alias.
200,Ratione distinctio quis architecto.
201,Rerum aperiam porro nulla.
202,Ipsam deleniti voluptatum et.
203,Voluptatibus omnis et asperiores.
204,Sint repellat sunt deserunt.
205,Quasi voluptatem eligendi natus.
206,Quis et beatae a.
207,Saepe repellat officia quas.
208,Nostrum voluptates sequi officiis.
209,Aspernatur voluptas omnis nisi.
210,Aut vero dolorem qui.
211,Autem ullam non veniam.
212,Enim consectetur voluptatem ipsam.
213,Quo aut voluptatem accusamus.
214,Alias impedit sint illo.
215,Est similique et accusantium.
216,Ab fugit quia animi.
217,Alias quia corporis est.
218,Consequatur est temporibus voluptatibus.
219,Et possimus repellat et.
220,Optio aperiam quasi molestias.
221,Dolores ut asperiores explicabo.
222,Quisquam aspernatur ut a.
223,Iusto reiciendis accusantium aut.
224,Praesentium architecto quo est.
225,Nulla optio culpa qui.
226,Nihil assumenda a et.
227,Occaecati aut rerum eligendi.
228,Dolore et ducimus et.
229,Odit dolor vel ut.
230,Perferendis culpa consectetur ut.
231,Ut consequatur veritatis ipsa.
232,Hic necessitatibus maiores omnis.
233,Beatae alias eveniet provident.
234,Sit rem est ea.
235,Voluptas doloribus eaque nihil.
236,Ut facilis voluptates sit.
237,Maxime vero nemo aut.
238,Quis perspiciatis ab magni.
239,Vel est quis possimus.
240,Quidem odio assumenda sit.
241,Labore autem distinctio a.
242,Aspernatur sit tempora delectus.
243,Quas vel ratione magni.
244,Ad debitis velit nemo.
245,Quia quos nostrum ut.
246,Deleniti maiores vero pariatur.
247,Cum qui sed in.
248,Repudiandae sit molestias velit.
249,Voluptatem iusto tempora fuga.
250,Corrupti et possimus est.
251,Eligendi dicta praesentium doloribus.
252,Molestiae quas officiis suscipit.
253,Fugit sunt quaerat perferendis.
254,Veritatis aliquid distinctio aperiam.
255,Labore necessitatibus dolor maxime.
256,Adipisci aut nihil cum.
257,Et illo repellendus ipsam.
258,Eligendi voluptatem blanditiis voluptas.
259,Rerum deserunt fugit ea.
260,Voluptas ipsa exercitationem ut.
261,Recusandae id excepturi odio.
262,Labore quam nam perferendis.
263,Neque porro quia ex.
264,Quisquam autem perferendis quae.
265,Est voluptas qui numquam.
266,Et ut iure magni.
267,Occaecati velit blanditiis consectetur.
268,Id molestiae exercitationem eaque.
269,Qui odit rem nesciunt.
270,Sequi neque eveniet ullam.
271,Incidunt harum quas in.
272,Perspiciatis quae sed facilis.
273,Reprehenderit voluptas alias nisi.
274,Eos velit similique neque.
275,Excepturi enim aperiam alias.
276,Architecto fuga sint quo.
277,Qui in sit veniam.
278,Officia aliquam voluptas soluta.
279,Vitae reprehenderit dolorum dolorem.
280,Minus impedit odio debitis.
281,Aspernatur facere sequi adipisci.
282,Qui suscipit et odio.
283,Quod cupiditate vitae ratione.
284,Deserunt itaque unde necessitatibus.
285,Porro voluptates perspiciatis ab.
286,Molestias sint odio quidem.
287,Quia eum accusamus nihil.
288,Architecto quia perferendis repellat.
289,Laboriosam aut aut dolor.
290,Aut deleniti sed voluptatem.
291,Ducimus et corrupti similique.
292,Eos sed quod dolorem.
293,Eveniet exercitationem in qui.
294,Voluptatem aliquam animi eos.
295,Delectus provident aut eos.
296,Fugiat unde et cupiditate.
297,Nostrum et ea atque.
298,Modi culpa facilis assumenda.
299,Voluptatem sit tempora accusamus.
300,Accusamus et voluptatibus repudiandae.
301,Tenetur doloribus aut quia.
302,Doloremque tempore amet accusantium.
303,In voluptas voluptatum voluptatem.
304,Iste ea qui autem.
305,Unde quibusdam nihil tempore.
306,Mollitia accusantium doloribus ad.
307,Qui quidem in ducimus.
308,Atque iste commodi corporis.
309,Rerum aut reiciendis a.
310,Et veritatis quia perferendis.
311,Ut labore tempora ducimus.
312,Amet rerum similique sed.
313,Corporis commodi qui cupiditate.
314,Dolores cum quod aut.
315,Autem harum nisi provident.
316,Laboriosam eius error ratione.
317,Enim sit maiores aliquam.
318,Quo beatae aut nobis.
319,Alias officia reprehenderit enim.
320,Molestias libero repellat veritatis.
321,Tempore et blanditiis dolor.
322,Et doloremque velit sunt.
323,Ab vero voluptas rerum.
324,Minus qui consequatur quae.
325,Suscipit libero non dolores.
326,Deserunt similique quidem modi.
327,Perferendis labore et nulla.
328,Facere repellendus qui inventore.
329,Est tempore dolorem blanditiis.
330,Nam repellat nesciunt iste.
331,Voluptates quisquam sint dolor.
332,Non qui suscipit voluptatem.
333,Similique et distinctio dicta.
334,Vero eum optio itaque.
335,Fugit iure iste asperiores.
336,Quae aliquid non quis.
337,Architecto fugiat omnis aut.
338,Illo eum voluptas dolore.
339,Dolores eveniet nisi facere.
340,Necessitatibus et sint blanditiis.
341,Et dolorem quis iste.
342,Hic qui expedita repellendus.
343,Voluptatem quis tenetur est.
344,Laboriosam tempore vero ut.
345,Praesentium eos sapiente officia.
346,Enim ratione commodi id.
347,Deserunt qui necessitatibus at.
348,Ut sunt dolor consequatur.
349,Aut iste amet praesentium.
350,Nostrum error consequatur hic.
351,Temporibus voluptatem soluta eius.
352,Exercitationem aspernatur qui quia.
353,Officiis cupiditate veritatis aperiam.
354,Illo ea suscipit culpa.
355,Qui dicta cum unde.
356,Accusantium quia voluptatum qui.
357,Reprehenderit repellat natus ab.
358,Sapiente quae quasi qui.
359,Nemo nobis ut reprehenderit.
360,Accusantium aut labore veritatis.
361,Ad ullam temporibus dolorem.
362,Laborum est qui nihil.
363,Voluptate accusamus maxime optio.
364,Repudiandae voluptas dicta autem.
365,Quisquam repellat inventore numquam.
366,Dignissimos accusantium veritatis quis.
367,Sunt nulla non ut.
368,Praesentium accusantium non dolor.
369,Libero consequatur ut quas.
370,Suscipit impedit aperiam natus.
371,Repellendus corporis minus nihil.
372,Dolorem repudiandae labore nemo.
373,Et distinctio vero ad.
374,Sit soluta quo qui.
375,Aliquam assumenda voluptatem laborum.
376,Occaecati quam et aut.
377,Sequi distinctio neque unde.
378,Ipsum labore qui architecto.
379,In nesciunt quo placeat.
380,Consequatur ipsam illum dolorem.
381,Provident qui sint quibusdam.
382,Est facilis voluptates qui.
383,Id voluptatem accusamus at.
384,Sint modi est nihil.
385,Voluptatem neque qui architecto.
386,Assumenda a quisquam non.
387,Esse voluptatem modi suscipit.
388,Eos mollitia hic aliquid.
389,Autem commodi quae architecto.
390,Distinctio voluptatem explicabo a.
391,Est incidunt facilis expedita.
392,Voluptas reiciendis qui temporibus.
393,Suscipit expedita repudiandae tenetur.
394,Autem deserunt veritatis natus.
395,Quasi ut aut enim.
396,Vel non dolore vitae.
397,Ea nesciunt sit ad.
398,Blanditiis inventore illum dicta.
399,Et consectetur quam at.
400,Ab provident nostrum quia.
401,Eaque natus aut sit.
402,Consequatur perferendis aut sed.
403,Officiis ad natus laudantium.
404,Rem voluptatem nihil accusamus.
405,Enim error et soluta.
406,Doloremque ut fuga culpa.
407,Non quod sed ut.
408,Fugit voluptates et repudiandae.
409,Quae quos voluptate accusamus.
410,Minus fugiat aut ut.
411,Aut et aut assumenda.
412,Itaque nisi nam totam.
413,Vel similique libero aut.
414,Qui fugit sed porro.
415,Et omnis quia corrupti.
416,Explicabo quos rerum sunt.
417,Officiis laboriosam doloribus sit.
418,Omnis laudantium quisquam est.
419,Est et tenetur incidunt.
420,Inventore at soluta velit.
421,Sit aut qui similique.
422,Doloribus porro repellat voluptatibus.
423,Autem nostrum ipsam rem.
424,Veniam voluptatem quo modi.
425,Et voluptatibus reprehenderit et.
426,Cupiditate praesentium natus porro.
427,Vitae accusamus eum deleniti.
428,Quasi illum exercitationem tempora.
429,Dicta aut eum saepe.
430,Et voluptatibus eligendi culpa.
431,Unde nostrum reprehenderit omnis.
432,Placeat amet quod provident.
433,Blanditiis voluptatem veritatis a.
434,Dolores mollitia delectus necessitatibus.
435,Dolores quaerat voluptatem ut.
436,Saepe quaerat a officiis.
437,Odit reiciendis impedit illum.
438,Est voluptas veritatis sunt.
439,Mollitia sapiente et voluptas.
440,Modi sit omnis deserunt.
441,Id sit repellat voluptates.
442,Voluptatum earum aspernatur ipsum.
443,Asperiores saepe placeat illum.
444,Fugiat vel laborum enim.
445,Quas unde quo corrupti.
446,Et enim rem tenetur.
447,Qui voluptates molestiae consectetur.
448,Vel reprehenderit tenetur facilis.
449,Sed sint est earum.
450,Est doloribus quod dolores.
451,Et aut excepturi quibusdam.
452,Laudantium ea eligendi aut.
453,Delectus ut eveniet velit.
454,Ex exercitationem commodi molestiae.
455,Et atque aliquam perspiciatis.
456,Nulla perferendis ut sed.
457,Ut occaecati omnis quis.
458,In architecto nostrum veritatis.
459,Neque veritatis quia et.
460,Aspernatur eligendi aut natus.
461,Est harum voluptas aut.
462,Ipsam velit nemo quia.
463,Eos libero laborum impedit.
464,Magnam quidem expedita voluptas.
465,Officiis aut sunt ea.
466,Voluptatem aspernatur enim iusto.
467,Quis libero rerum sit.
468,Quia qui quas reiciendis.
469,Iste est sunt necessitatibus.
470,Ducimus quis vero nesciunt.
471,Cumque eveniet voluptatem ea.
472,Ut voluptatem nihil aut.
473,Cumque vel omnis in.
474,Hic facilis nihil delectus.
475,Soluta omnis vel placeat.
476,Qui ut rem dignissimos.
477,Recusandae iusto necessitatibus autem.
478,Rerum blanditiis voluptates sit.
479,Nostrum quidem aperiam qui.
480,Praesentium et deserunt dolores.
481,Voluptatem libero ad illo.
482,Eveniet debitis et eius.
483,Laborum perferendis quis qui.
484,Minima dolor occaecati sit.
485,Error eaque omnis quia.
486,In saepe ullam quia.
487,Eaque architecto est culpa.
488,Occaecati mollitia cum sed.
489,Aut sint maxime excepturi.
490,Dolores veniam voluptas eum.
491,Ut nihil et adipisci.
492,In fugiat praesentium et.
493,Consequuntur quasi ad ipsum.
494,Velit et sequi ipsum.
495,Voluptate totam alias soluta.
496,Repudiandae perspiciatis provident consequatur.
497,Atque consectetur quam et.
498,Sunt similique repudiandae unde.
499,Et harum qui rerum.
500,Omnis enim cupiditate quae.
501,Nostrum nam ut consectetur.
502,Quis velit repellendus voluptatem.
503,Porro aut corporis provident.
504,Dolorem dolor exercitationem inventore.
505,Praesentium voluptatibus eveniet veritatis.
506,Aut consequatur sed voluptates.
507,Incidunt voluptas odio rerum.
508,Quam enim hic ut.
509,Itaque autem fugit nulla.
510,Aut autem facere autem.
511,Exercitationem ab voluptates fugiat.
512,Et a iusto vel.
513,Occaecati repudiandae ratione nostrum.
514,Quae amet repellendus dolores.
515,Cupiditate eveniet ut rerum.
516,Mollitia reiciendis recusandae pariatur.
517,Exercitationem aperiam sint perspiciatis.
518,Assumenda ducimus corporis fugit.
519,Et sit et beatae.
520,Dicta facilis ducimus occaecati.
521,Doloremque molestias sit modi.
522,Soluta quasi voluptas consectetur.
523,Doloribus repellendus repellat maxime.
524,Ut id sit et.
525,Repudiandae vel deserunt hic.
526,Cumque fuga at labore.
527,Optio sed et nihil.
528,Officia et eum accusamus.
529,Sed non atque dolorum.
530,Doloribus blanditiis expedita sit.
531,Exercitationem sed illum tempora.
532,Nam neque tempora nostrum.
533,Occaecati enim ipsam excepturi.
534,Iusto odio quas adipisci.
535,Facilis iure esse sit.
536,Fugit adipisci ut rem.
537,Laborum voluptatem omnis vel.
538,Voluptas praesentium alias ex.
539,Dolore vero consequuntur voluptatum.
540,Recusandae est iusto quo.
541,Repellendus aut omnis qui.
542,Vel ea enim maiores.
543,Repellendus illum quia ipsam.
544,At quis aut ad.
545,Adipisci qui animi excepturi.
546,Animi omnis qui est.
547,Doloribus et corrupti neque.
548,Asperiores cum non commodi.
549,Veritatis laboriosam ipsam tempora.
550,Praesentium ut aliquam pariatur.
551,Temporibus impedit reprehenderit fugit.
552,Ipsa illo accusamus repellat.
553,Occaecati dolorum at magni.
554,Et natus eum nam.
555,Exercitationem occaecati in sint.
556,Ratione aut vel est.
557,Sint aut occaecati consectetur.
558,Excepturi asperiores fugiat pariatur.
559,Est qui culpa porro.
560,Nihil voluptatem explicabo eum.
561,Molestiae sit quia et.
562,Quisquam autem nisi repudiandae.
563,Quae ut quia adipisci.
564,Asperiores nulla ipsum et.
565,Qui ut ex voluptate.
566,Eum eius est accusantium.
567,Fugiat corrupti consequatur fuga.
568,Possimus ut ratione qui.
569,Aut rerum rem a.
570,Voluptatem sint nam et.
571,Dolorum asperiores sequi velit.
572,Dignissimos sit quia et.
573,Ullam exercitationem ea fugit.
574,Ad aspernatur vero facere.
575,Atque ea quaerat beatae.
576,Ut doloribus qui explicabo.
577,Aut ex eos impedit.
578,Illum et tenetur labore.
579,Porro magnam atque quidem.
580,Assumenda officiis voluptate nostrum.
581,Et consectetur quis dolorum.
582,Culpa et et et.
583,Ipsam autem iure sit.
584,Libero corporis ut et.
585,Eius et odit repellat.
586,Enim dolor et blanditiis.
587,Libero quaerat minus odio.
588,Quia et est pariatur.
589,Impedit autem qui similique.
590,Veniam voluptatem architecto quis.
591,Aut molestiae recusandae dolor.
592,Inventore quia beatae cupiditate.
593,A omnis perferendis sint.
594,Voluptatem qui voluptas quod.
595,Vero possimus harum voluptatem.
596,Explicabo non architecto in.
597,Iste quas amet dignissimos.
598,Harum iusto hic et.
599,Officia ipsa tenetur autem.
600,Consectetur nostrum quia qui.
601,Voluptatem libero quia ut.
602,Est ad neque inventore.
603,Qui non adipisci reiciendis.
604,Ea et minima minus.
605,Rerum et illum suscipit.
606,Veritatis repellat eaque et.
607,Qui non dolor quas.
608,Delectus nihil iure at.
609,Ipsum ut aliquid et.
610,Non quisquam maxime deleniti.
611,Quisquam tenetur nostrum dolor.
612,Aut impedit temporibus velit.
613,Veritatis voluptates totam eos.
614,Nemo veritatis distinctio consequatur.
615,Consequatur eveniet et sapiente.
616,Error reiciendis temporibus est.
617,Quia voluptatem ut modi.
618,Quaerat est vel rerum.
619,Sunt et accusamus labore.
620,Nesciunt accusamus sit eum.
621,Et fugiat quisquam odit.
622,Nam labore quibusdam voluptatibus.
623,Qui aut sapiente placeat.
624,Beatae ut eum in.
625,Officia est saepe et.
626,Corrupti voluptas fuga minus.
627,Sed mollitia tempore minus.
628,Provident enim ad sint.
629,Itaque est et adipisci.
630,Excepturi libero beatae adipisci.
631,Consequuntur laudantium ducimus ipsam.
632,Sequi et quasi vero.
633,Ut est unde et.
634,Modi illum animi ea.
635,Tempore expedita voluptas et.
636,Quo laudantium officiis provident.
637,Et perferendis doloribus consequatur.
638,Quaerat voluptate culpa quidem.
639,Dolor quod qui tempore.
640,Modi voluptas tempora error.
641,Illo vel quam et.
642,Deleniti sint aliquid ex.
643,Rerum voluptas voluptatem minus.
644,Harum aut numquam itaque.
645,Rerum nulla et et.
646,Facere velit quia ex.
647,Et alias harum consectetur.
648,Sit in exercitationem iure.
649,Molestiae aut ea dolorem.
650,Quasi deleniti non in.
651,Alias debitis non dolorem.
652,Quo tempore sint temporibus.
653,Maiores laudantium quis minus.
654,Rerum alias eveniet illo.
655,Et pariatur cumque laudantium.
656,Mollitia vero molestiae rerum.
657,Et vel consequatur vel.
658,Qui ratione repudiandae sapiente.
659,Ut voluptatem deleniti id.
660,Aut at ut dicta.
661,Ipsam et eligendi tempora.
662,Autem beatae sed molestias.
663,Eos fuga et consequatur.
664,Dolores mollitia et enim.
665,Rerum aliquid necessitatibus sint.
666,Dicta recusandae dolorum qui.
667,Eos quas doloremque et.
668,Accusantium porro quia dolorem.
669,Quos illo exercitationem fuga.
670,Fuga ab et perspiciatis.
671,Fuga exercitationem unde ex.
672,Maxime quod ducimus atque.
673,Porro veritatis natus et.
674,Dolor quo quibusdam quidem.
675,Quia fuga cupiditate tenetur.
676,Cum tempora eligendi non.
677,Natus corrupti aut laudantium.
678,Dolores asperiores alias sapiente.
679,Quo consequatur nesciunt dolorem.
680,Voluptatem in reprehenderit voluptate.
681,Pariatur velit dolores dolor.
682,Ad voluptas dicta accusantium.
683,Ut ducimus et quibusdam.
684,Voluptatem cum quibusdam voluptas.
685,Voluptas dolorem enim reprehenderit.
686,Atque saepe occaecati corporis.
687,Voluptatem nam non possimus.
688,Et deleniti nam voluptate.
689,Quo quos quisquam cumque.
690,Dolorem molestiae accusantium aut.
691,Vero ut veniam in.
692,Sed ipsam qui non.
693,Atque voluptas voluptatem ipsum.
694,Quo ab delectus qui.
695,Doloremque rerum tenetur quos.
696,Minus eius fugit est.
697,Sunt ullam repudiandae dolorem.
698,Laudantium nobis debitis nostrum.
699,Dolores et consequatur velit.
700,Perferendis quia rerum voluptate.
701,Quia consequuntur delectus est.
702,Dolorem at et maiores.
703,Alias corporis quo nostrum.
704,Harum et dolorem ipsa.
705,A consequuntur deleniti ipsa.
706,Laborum vero odit dolor.
707,Molestiae eveniet explicabo dignissimos.
708,Voluptas mollitia ut sunt.
709,Harum culpa esse et.
710,Impedit officia tempore aut.
711,Magni maiores mollitia at.
712,Voluptas sed incidunt sit.
713,Similique molestiae assumenda aut.
714,Voluptatem ut ut nam.
715,Repudiandae ipsa odio cum.
716,Est alias qui fugit.
717,Voluptatem doloribus magni laboriosam.
718,Quaerat in fugit asperiores.
719,Magnam aut delectus pariatur.
720,Veniam est soluta molestias.
721,Optio a sunt quia.
722,Provident delectus ad fugiat.
723,Odio repellat voluptatem et.
724,Consectetur dolor illo dolores.
725,Ipsum doloribus quas dolores.
726,Consequatur dolor sapiente ut.
727,Similique ea dolores laboriosam.
728,Iusto quo vel ipsum.
729,Aliquid tenetur placeat quas.
730,Odit dolore eveniet fugiat.
731,Voluptatum velit magni nesciunt.
732,Reiciendis libero voluptatibus molestias.
733,Laudantium labore dolor ea.
734,Dolorem numquam ut occaecati.
735,Dolores rem rerum dolores.
736,Aspernatur eligendi dolor sed.
737,Ut veritatis maxime corporis.
738,Doloremque qui est explicabo.
739,Vel libero facilis ut.
740,Voluptatem minima et rerum.
741,Eum id modi sed.
742,Consequatur veniam inventore numquam.
743,Quis aut saepe non.
744,Autem ullam perferendis ut.
745,Ab error id eligendi.
746,Voluptatem doloremque perferendis quia.
747,Est facere quaerat ut.
748,Corporis soluta quaerat deleniti.
749,Qui labore et distinctio.
750,Suscipit deleniti aperiam minima.
751,Aliquam et similique magni.
752,Voluptates architecto ab id.
753,Ut sed maiores officia.
754,Pariatur eaque eveniet expedita.
755,Nihil sed architecto voluptas.
756,Nihil qui ut aut.
757,Veniam reprehenderit itaque et.
758,Eligendi et enim impedit.
759,Cupiditate quibusdam sunt ut.
760,Ipsam aliquid in beatae.
761,Sit rerum inventore reprehenderit.
762,Dolor rerum non quam.
763,Eos et maxime facilis.
764,Tempora minima doloremque similique.
765,Modi ullam laudantium voluptatum.
766,Quaerat necessitatibus deleniti atque.
767,Explicabo magni rem error.
768,Dicta eos inventore ea.
769,Illum sed officiis et.
770,Qui ab dolore in.
771,Officia rem accusamus iure.
772,Eum iste omnis et.
773,Quas et modi ab.
774,Ut quos delectus aspernatur.
775,Nostrum similique aliquam at.
776,Est expedita quis voluptatem.
777,Et nesciunt quasi quaerat.
778,Doloremque officia suscipit totam.
779,Doloremque quisquam amet nemo.
780,Culpa accusantium in cumque.
781,Iste et nobis inventore.
782,Ut autem velit omnis.
