recipe_id,note_descript
4599,Autem omnis quis dicta.
4600,Ut quia necessitatibus distinctio.
4601,Architecto quibusdam ipsum sunt.
4602,Quae adipisci ipsam accusamus.
4603,Et nam quidem aspernatur.
4604,Facilis impedit odio incidunt.
4605,Quis dolore hic omnis.
4606,Excepturi vitae fugit vero.
4607,Perferendis asperiores nihil non.
4608,Quae perferendis voluptas aspernatur.
4609,Quasi aperiam et fugit.
4610,Libero et illo et.
4611,Ullam error aut neque.
4612,Fugit iure libero vel.
4613,Perspiciatis modi quis fugiat.
4614,Id quis doloremque voluptates.
4615,Tempora ipsa doloribus recusandae.
4616,Ducimus quia eius enim.
4617,Qui non nobis sint.
4618,Et qui aut nobis.
4619,Et corporis iure voluptate.
4620,Ut alias voluptatem sit.
4621,Accusamus doloribus quibusdam unde.
4622,Ea aut dignissimos blanditiis.
4623,Eveniet hic tempora et.
4624,Similique perferendis odit reiciendis.
4625,Iusto asperiores quod dolorem.
4626,Consequuntur ut nisi ut.
4627,Blanditiis expedita ea sit.
4628,Quas aut vero ratione.
4629,Alias occaecati nesciunt debitis.
4630,Tenetur unde est similique.
4631,Et asperiores libero nobis.
4632,Quo rerum debitis voluptatem.
4633,Dolores dolore magnam voluptatem.
4634,Asperiores sunt modi quas.
4635,Aperiam cumque corporis perspiciatis.
4636,Ipsam occaecati voluptatum ut.
4637,Quia ipsum voluptatibus laborum.
4638,Suscipit reprehenderit fugit iste.
4639,Eum laboriosam numquam rem.
4640,Animi saepe inventore laudantium.
4641,Accusantium illo maxime quibusdam.
4642,Odit enim quia optio.
4643,Quae qui quo dolores.
4644,Aut ducimus velit iste.
4645,Nam officia et voluptatem.
4646,Illum quasi est eum.
4647,Quas minus excepturi in.
4648,Quaerat ducimus sed beatae.
4649,Ab qui et quia.
4650,Pariatur ut laudantium fugiat.
4651,Illum provident consequatur itaque.
4652,Et illo vitae cum.
4653,Eaque a aut qui.
4654,Corrupti itaque numquam temporibus.
4655,Qui facere quos perferendis.
4656,Minus tempora enim qui.
4657,Qui sapiente sequi sunt.
4658,Ducimus quia eligendi quia.
4659,Esse nihil est ut.
4660,Soluta veritatis sit et.
4661,Cupiditate reiciendis quasi rerum.
4662,Consectetur cum id voluptatem.
4663,Itaque laboriosam odit quisquam.
4664,Dolores hic id omnis.
4665,Dolore nesciunt incidunt natus.
4666,Et ipsum dolor quia.
4667,Dolores culpa consequatur quasi.
4668,Vel aspernatur velit dolore.
4669,Quisquam ea cupiditate deleniti.
4670,Cumque similique non alias.
4671,Harum voluptas provident minima.
4672,Ex quasi assumenda quam.
4673,Totam commodi hic corrupti.
4674,Architecto quibusdam eligendi voluptatum.
4675,Culpa et repudiandae reprehenderit.
4676,Nihil repellendus possimus rerum.
4677,Ratione accusantium iure et.
4678,Velit eaque id et.
4679,Labore ut id veritatis.
4680,Iusto sed quidem cum.
4681,Reiciendis rerum fuga culpa.
4682,Dolorem rerum praesentium id.
4683,Rerum velit ut at.
4684,Reiciendis in ut accusantium.
4685,Assumenda animi qui dignissimos.
4686,Dolorem vero suscipit quia.
4687,Eaque unde aliquam omnis.
4688,Illum ad et est.
4689,Numquam quidem voluptas sed.
4690,Dolorem est fugit architecto.
4691,Qui harum nobis voluptas.
4692,Sunt dolor alias sint.
4693,Voluptas atque recusandae animi.
4694,Sed ab assumenda aut.
4695,Quaerat voluptatem eligendi in.
4696,Sequi sit explicabo similique.
4697,Quidem beatae occaecati in.
4698,Voluptatem voluptatem beatae dolorem.
4699,Tempore officia omnis similique.
4700,Adipisci iusto optio a.
4701,Quo sit itaque iste.
4702,Non dignissimos quia architecto.
4703,Dolor accusamus cum temporibus.
4704,Quidem et eligendi in.
4705,Voluptas exercitationem vel nostrum.
4706,Cumque architecto maiores dolorem.
4707,Cum error et expedita.
4708,Vel in numquam illum.
4709,Illum in eos sit.
4710,Enim id nostrum et.
4711,Quia animi officia molestias.
4712,Quisquam iusto fugit fuga.
4713,Aliquid natus nihil blanditiis.
4714,Eos mollitia a quia.
4715,Quas recusandae a atque.
4716,Soluta eaque temporibus fugiat.
4717,Qui a et reiciendis.
4718,Qui corporis placeat consequatur.
4719,Delectus voluptatem asperiores deleniti.
4720,Temporibus corrupti dolor numquam.
4721,Nihil facilis laboriosam quo.
4722,Dolor debitis quasi quisquam.
4723,Nulla occaecati accusamus omnis.
4724,Velit debitis pariatur deserunt.
4725,Doloribus nisi tempora quisquam.
4726,Sint nam eos corporis.
4727,Facilis culpa consectetur ducimus.
4728,Natus praesentium quis fuga.
4729,Enim velit quaerat doloremque.
4730,Sint ex ipsum aut.
4731,Molestiae error eius a.
4732,Et tenetur et inventore.
4733,Est quaerat aut iusto.
4734,Ex suscipit rerum nihil.
4735,Sequi voluptatem dolorum fugit.
4736,Dolorum sapiente accusamus laudantium.
4737,Cupiditate officiis adipisci dolor.
4738,Sapiente ut molestiae fuga.
4739,Qui ipsam laboriosam qui.
4740,Qui quidem ut quis.
4741,Maxime dolores sit sit.
4742,Voluptatem nisi possimus sed.
4743,Temporibus nihil non deleniti.
4744,Rerum quidem sed quibusdam.
4745,Ducimus tempore sequi quibusdam.
4746,Iusto vel labore architecto.
4747,Sint tempore alias atque.
4748,Et aut quod eum.
4749,Aperiam quidem blanditiis deserunt.
4750,Vero suscipit fuga aut.
4751,Omnis quia eos asperiores.
4752,Minus molestiae sint qui.
4753,Tempora libero nam consequatur.
4754,Asperiores doloremque amet saepe.
4755,Odit voluptates voluptatem est.
4756,Quam sit aliquid rerum.
4757,Quam minima eaque inventore.
4758,Quia molestiae impedit optio.
4759,Quas ut accusantium repudiandae.
4760,Non libero sint voluptatem.
4761,Praesentium iste minima ut.
4762,A exercitationem sit officia.
4763,Quisquam cumque quae vel.
4764,Porro enim id recusandae.
4765,Accusantium sunt ipsa perspiciatis.
4766,Dolores voluptatum provident expedita.
4767,Est reprehenderit est voluptatibus.
4768,Debitis doloribus quae voluptatem.
4769,Eaque minima ducimus dolor.
4770,Praesentium repellat quisquam est.
4771,Sed consectetur corrupti saepe.
4772,Fugiat eos cupiditate rem.
4773,Deserunt omnis quaerat et.
4774,Aut quasi amet enim.
4775,Voluptates facere officia et.
4776,Quae aliquam beatae doloremque.
4777,Quam enim minus atque.
4778,Temporibus ipsa quasi beatae.
4779,Explicabo autem illum quasi.
4780,Nisi nihil qui non.
4781,Et iste voluptas rerum.
4782,Qui consectetur laudantium ut.
4783,Deleniti hic sed placeat.
4784,Odio dolores fugit et.
4785,Reiciendis numquam quidem praesentium.
4786,Exercitationem repellat nulla accusamus.
4787,Consequatur eos sit autem.
4788,Praesentium eum soluta beatae.
4789,Qui quis dolor facilis.
4790,Vel commodi qui laborum.
4791,Qui vero laudantium molestiae.
4792,Inventore quo asperiores voluptatem.
4793,Enim ad labore qui.
4794,Nostrum molestiae optio ab.
4795,Soluta eius odio et.
4796,Voluptas et accusamus ea.
4797,Alias quasi velit est.
4798,Ipsa et porro minima.
4799,Omnis aut repellat consequuntur.
4800,Magni labore deserunt debitis.
4801,Consequatur possimus voluptas amet.
4802,Libero saepe voluptates corporis.
4803,Laudantium voluptatum vitae non.
4804,Ab optio provident omnis.
4805,Vel ducimus deserunt voluptas.
4806,Ipsum cupiditate et blanditiis.
4807,Eos beatae enim suscipit.
4808,Nostrum necessitatibus eum dignissimos.
4809,Ut labore veniam incidunt.
4810,Aut provident quis quia.
4811,Veritatis ab et odit.
4812,Unde aut provident laborum.
4813,Placeat est aut quia.
4814,Exercitationem nemo dolorum ex.
4815,Qui quod voluptatibus reiciendis.
4816,Modi reiciendis dolor voluptatem.
4817,In consectetur corrupti minima.
4818,Eos culpa praesentium temporibus.
4819,Architecto est molestias et.
4820,Et non doloribus velit.
4821,At illo possimus dolor.
4822,Debitis consectetur officia veritatis.
4823,Quibusdam ut labore et.
4824,Nisi et placeat repellat.
4825,Alias voluptas non odio.
4826,Aut qui tenetur numquam.
4827,Velit aut ab asperiores.
4828,Ut omnis officia saepe.
4829,Ipsum suscipit eveniet consequatur.
4830,Aut ut non consequuntur.
4831,Qui animi sed necessitatibus.
4832,Non autem ut adipisci.
4833,Provident unde vitae tempora.
4834,Rerum enim id magnam.
4835,Et et doloribus aut.
4836,Quo molestiae eum ad.
4837,Aut tempora odio ut.
4838,Nesciunt iste ut architecto.
4839,Non est voluptatem iusto.
4840,Et natus quis pariatur.
4841,Nam reiciendis impedit ut.
4842,Et consequatur architecto et.
4843,Esse autem quia et.
4844,Sed ut consequuntur porro.
4845,Similique labore ex in.
4846,Ad omnis asperiores autem.
4847,In id non perspiciatis.
4848,Unde aut dolorem ipsum.
4849,Voluptates autem eveniet nisi.
4850,Dolorum ut maiores sed.
4851,Corrupti sunt reprehenderit laborum.
4852,Omnis libero ducimus quis.
4853,Explicabo modi et perspiciatis.
4854,Consequatur voluptatum facere culpa.
4855,Et in iusto provident.
4856,Impedit culpa illum fuga.
4857,Molestiae atque maiores ipsum.
4858,Iure aut ex laboriosam.
4859,Molestiae nostrum voluptatem ut.
4860,Repudiandae autem sed dolore.
4861,Vero veritatis ea et.
4862,Et accusamus sunt officia.
4863,Quas dolorem qui occaecati.
4864,Illo enim quibusdam eum.
4865,Saepe maiores nam amet.
4866,Dignissimos aut consequatur aliquam.
4867,Non alias qui labore.
4868,Consequatur est ex autem.
4869,Facilis in qui corporis.
4870,Officia voluptatibus laborum aut.
4871,Similique sunt et et.
4872,Enim ipsa architecto voluptatem.
4873,Eligendi necessitatibus animi fugit.
4874,Et sed incidunt in.
4875,Ullam necessitatibus amet quibusdam.
4876,Quam repellendus aut nihil.
4877,Illum sit et id.
4878,Nemo autem nobis est.
4879,Sequi et dicta dolor.
4880,Voluptatem eos quia deleniti.
4881,Sint nihil dolores quibusdam.
4882,Eum aliquam non laboriosam.
4883,Suscipit eveniet itaque non.
4884,Sint nam eligendi ut.
4885,Aut dolores consequatur aut.
4886,Non sit officiis ut.
4887,Praesentium eligendi autem omnis.
4888,Et excepturi dicta nulla.
4889,Et omnis voluptatum voluptas.
4890,Et ut non ab.
4891,Deserunt quidem doloremque vero.
4892,Qui iste unde et.
4893,Unde debitis sapiente rem.
4894,Totam nostrum sed sit.
4895,Vitae sint nostrum dolorem.
4896,Ab quia eum voluptates.
4897,Est provident atque dolores.
4898,Libero quas sit possimus.
4899,Nulla non vitae consequuntur.
4900,Eligendi est suscipit odio.
4901,Officiis sed sit sint.
4902,Unde natus in labore.
4903,Error quia et repellat.
4904,Sit nesciunt qui non.
4905,Voluptatem quaerat natus ex.
4906,Est reiciendis aperiam et.
4907,Quibusdam molestiae est ducimus.
4908,Sed non quis nesciunt.
4909,Nesciunt delectus culpa quibusdam.
4910,Temporibus iste sed aliquam.
4911,Molestiae nisi nesciunt omnis.
4912,Ducimus officiis cum voluptas.
4913,Perspiciatis aliquam omnis asperiores.
4914,Voluptatem et animi sunt.
4915,Blanditiis aut inventore ut.
4916,Voluptas ut dolorem porro.
4917,Tenetur unde error est.
4918,Repellendus commodi consequatur quia.
4919,Vero sed aspernatur ratione.
4920,Eveniet qui minima officia.
4921,Accusantium eveniet dolorem odio.
4922,Est dolor corporis ea.
4923,Eum soluta labore ratione.
4924,Mollitia et autem et.
4925,Est nulla recusandae libero.
4926,Impedit minima quia ratione.
4927,Veniam vel tempore suscipit.
4928,Vel voluptas culpa eum.
4929,Quae quia enim nisi.
4930,Totam accusamus enim et.
4931,Iusto dicta eveniet laudantium.
4932,Fuga esse accusantium minus.
4933,Cumque vero provident sint.
4934,Quas quisquam repellat aut.
4935,Sint consequatur cum reiciendis.
4936,Et placeat ipsam excepturi.
4937,Qui est iure et.
4938,Non exercitationem error rem.
4939,Distinctio ut velit blanditiis.
4940,Delectus quasi impedit autem.
4941,Sint iusto numquam amet.
4942,Consequatur excepturi in in.
4943,Consequuntur qui magni qui.
4944,Voluptas laudantium labore culpa.
4945,Ea unde aut voluptatum.
4946,Molestiae et ipsum officia.
4947,Quasi iure et velit.
4948,Facilis nam dignissimos tempore.
4949,Et quis vel laborum.
4950,Itaque dolorem at omnis.
4951,Veniam molestiae et ut.
4952,Sed sit vel quaerat.
4953,Voluptatem voluptas iure corporis.
4954,Explicabo aut tenetur iste.
4955,Magnam aliquid ea ut.
4956,Ex et numquam fuga.
4957,Et quo et sed.
4958,Ut perferendis veniam aut.
4959,Atque provident nulla aut.
4960,Dolor iure et sint.
4961,Aut aliquam et sequi.
4962,Officia aut alias inventore.
4963,Aperiam officia inventore sit.
4964,Libero voluptatibus est illo.
4965,Minima amet tenetur consectetur.
4966,Est temporibus rerum aliquam.
4967,Non ratione quibusdam possimus.
4968,Veritatis laborum quam reprehenderit.
4969,Amet dolor et animi.
4970,Eos molestias animi maxime.
4971,Expedita temporibus rem qui.
4972,Consectetur dolorum sunt quam.
4973,Sint nemo dolores voluptatum.
4974,Harum iste illum ex.
4975,Vitae vel aspernatur culpa.
4976,Asperiores vel reiciendis eos.
4977,Doloremque illum quas consectetur.
4978,Rerum ullam exercitationem ea.
4979,Vitae dolore id et.
4980,Dolore quae quis totam.
4981,Omnis vero esse placeat.
4982,Nostrum in minus nulla.
4983,Odio vitae ad possimus.
4984,Rerum recusandae aut quidem.
4985,Consequatur minima ea ratione.
4986,Voluptatem libero inventore maiores.
4987,Corporis est consequatur laborum.
4988,Ex non inventore sit.
4989,Et laboriosam in excepturi.
4990,Enim perspiciatis dolores optio.
4991,Adipisci et nobis quo.
4992,Eum rerum adipisci molestiae.
4993,Omnis autem praesentium culpa.
4994,Et necessitatibus nisi eos.
4995,Quisquam similique cupiditate sit.
4996,Et sit assumenda quod.
4997,Minus dolorem similique qui.
4998,Sed voluptatibus perferendis quaerat.
4999,Quisquam est explicabo vitae.
5000,Quam alias placeat voluptatibus.
5001,Explicabo et aut qui.
5002,Autem ut inventore ipsam.
5003,Asperiores maiores reiciendis optio.
5004,Quo at asperiores et.
5005,Ipsum voluptatem dignissimos soluta.
5006,Rerum adipisci modi qui.
5007,Non odit tempora voluptatibus.
5008,Officiis repudiandae deserunt amet.
5009,Qui velit dolorem a.
5010,Aliquid magnam ducimus eum.
5011,Rerum modi odit nulla.
5012,Consequatur et aut at.
5013,Consequatur excepturi quisquam qui.
5014,Et qui quasi sit.
5015,Qui consequatur voluptas itaque.
5016,Quia magni eos qui.
5017,Est voluptates nulla ea.
5018,Accusantium consectetur at necessitatibus.
5019,Inventore id distinctio eum.
5020,Ut id quos tempora.
5021,Quia sed ea eum.
5022,Dolor ex minus voluptas.
5023,Dolorem totam quia consequatur.
5024,Architecto id quibusdam nemo.
5025,Accusantium eos deleniti adipisci.
5026,Perspiciatis optio eius autem.
5027,Est non in nihil.
5028,Dolorem velit est perspiciatis.
5029,Animi fugiat ut consequatur.
5030,Dolor et sapiente mollitia.
5031,Delectus dolores accusamus earum.
5032,Accusantium est voluptatibus odit.
5033,Qui iste repellat consequatur.
5034,Sed praesentium doloribus facere.
5035,Mollitia non dolorem qui.
5036,Illum quis vitae aut.
5037,Quis iusto omnis consectetur.
5038,Est atque fugit libero.
5039,Animi eum iste earum.
5040,Ex saepe et laudantium.
5041,Et quas nihil quibusdam.
5042,Animi minus rem aperiam.
5043,Quod voluptatem iusto et.
5044,Deserunt qui sed accusamus.
5045,Et sunt aut eius.
5046,Voluptatibus dolor magnam ipsa.
5047,Omnis debitis aliquam nisi.
5048,Ex voluptas facilis expedita.
5049,Doloremque expedita ea aut.
5050,Est et accusamus eum.
5051,Iure sint ea laboriosam.
5052,Ipsam corporis eum dolores.
5053,Harum pariatur eum accusamus.
5054,Consequatur maiores quidem aperiam.
5055,Omnis blanditiis libero cupiditate.
5056,Eveniet repudiandae quisquam sint.
5057,Occaecati at sed dolorem.
5058,Deleniti et voluptatibus molestias.
5059,Consectetur occaecati ea qui.
5060,Est aut aperiam aliquid.
5061,Ea ut dolorem placeat.
5062,Odit aliquid suscipit impedit.
5063,Iusto illum ipsum non.
5064,Eius molestiae aut excepturi.
5065,Minus tempore sit qui.
5066,Nam delectus repellendus eveniet.
5067,Odio corrupti enim natus.
5068,Quisquam sunt nostrum ipsa.
5069,Quia ullam provident et.
5070,Optio voluptates laboriosam laudantium.
5071,Dicta nobis aut aut.
5072,Consectetur nulla quae ut.
5073,Nisi voluptatem explicabo rerum.
5074,Nulla ut est numquam.
5075,Saepe non dolore sequi.
5076,Ipsa aut neque deserunt.
5077,Et eligendi perspiciatis maiores.
5078,Doloremque maxime quo possimus.
5079,Assumenda quae error autem.
5080,Sed tempore molestias ducimus.
5081,Nostrum similique consectetur non.
5082,Dolores quia et iste.
5083,Soluta reprehenderit qui sed.
5084,Corrupti sequi et ut.
5085,Excepturi temporibus occaecati aut.
5086,Adipisci excepturi maiores dignissimos.
5087,Qui minima magnam numquam.
5088,Culpa deserunt dolor dignissimos.
5089,Necessitatibus enim et sit.
5090,Incidunt magni reiciendis quia.
5091,Ab quas sapiente hic.
5092,Ut non eius voluptate.
5093,Nostrum illum doloremque et.
5094,Nisi quas sapiente et.
5095,Corporis itaque adipisci voluptas.
5096,Expedita sequi odio fuga.
5097,Eius cupiditate temporibus tempore.
5098,Adipisci error magnam in.
5099,Inventore odit debitis voluptatem.
5100,Harum aliquid voluptatem quos.
5101,Odio voluptas ipsa ad.
5102,Nisi aspernatur ipsum dolor.
5103,Qui et aperiam in.
5104,Aliquid odio culpa voluptatibus.
5105,Omnis praesentium iure et.
5106,Qui impedit nobis deleniti.
5107,Sit dicta excepturi molestiae.
5108,Ut qui id architecto.
5109,Et odit autem laboriosam.
5110,Veniam impedit reprehenderit inventore.
5111,Iste unde non possimus.
5112,Saepe aspernatur sunt impedit.
5113,Non aspernatur expedita unde.
5114,Suscipit placeat quis esse.
5115,Incidunt voluptates itaque repellendus.
5116,Magni quis ratione reiciendis.
5117,Quia voluptatum eveniet esse.
5118,Possimus aliquam aliquid est.
5119,Eaque dolore possimus maiores.
5120,Ratione aliquid dolorem adipisci.
5121,Rerum corrupti minus exercitationem.
5122,Dolores ipsam omnis repellendus.
5123,Quas magni est et.
5124,Beatae cumque pariatur quasi.
5125,Deserunt nam eos maiores.
5126,Ex consectetur est nemo.
5127,Suscipit laborum odit pariatur.
5128,Aspernatur sed perferendis non.
5129,Iure assumenda sunt tempore.
5130,Ex minima facere ipsum.
5131,Dolorem reiciendis quaerat voluptatem.
5132,Deserunt pariatur sint facilis.
5133,Quis laudantium vero incidunt.
5134,Explicabo officia accusantium aut.
5135,Est et qui occaecati.
5136,Ea dolor amet id.
5137,Vero vel velit veniam.
5138,Qui minima mollitia velit.
5139,Laboriosam nobis sunt autem.
5140,Temporibus error sapiente quis.
5141,Ab ut molestiae cum.
5142,Rerum maiores iure eaque.
5143,Sunt a aut distinctio.
5144,Dolorem dolor nobis quae.
5145,Voluptas sint nam repellendus.
5146,Suscipit fugiat nihil ducimus.
5147,Impedit aliquid est quos.
5148,Nostrum sed expedita odio.
5149,Pariatur est velit labore.
5150,Esse recusandae est qui.
5151,Voluptas omnis voluptate corporis.
5152,Temporibus possimus et et.
5153,Non quia aperiam tempore.
5154,Ut deserunt sint debitis.
5155,Ea voluptate et officiis.
5156,Ut quidem necessitatibus dolores.
5157,Exercitationem consequatur eveniet nulla.
5158,Quod blanditiis enim voluptatem.
5159,Natus perferendis illum aliquam.
5160,Rem et velit sit.
5161,Est recusandae quis optio.
5162,Ut in officiis impedit.
5163,Vitae distinctio commodi vero.
5164,Provident quia nemo dolores.
5165,Necessitatibus est autem velit.
5166,Quo et doloribus eveniet.
5167,Consequatur sit est possimus.
5168,Ut sunt neque ut.
5169,Placeat nihil omnis qui.
5170,Harum omnis soluta provident.
5171,Quia molestiae repellat similique.
5172,Tenetur cumque consequatur a.
5173,Dolorem consequuntur ut quisquam.
5174,Unde rerum sint quia.
5175,Et consequuntur ut est.
5176,Qui illum asperiores ea.
5177,Ducimus quae pariatur illo.
5178,Neque et vitae tempore.
5179,Fugit voluptatibus voluptate illo.
5180,Voluptatum qui quod occaecati.
5181,Reiciendis quidem sit et.
5182,Atque dolores ratione dignissimos.
5183,Consectetur suscipit quis sed.
5184,Fugit est et sed.
5185,Rerum quaerat accusamus nam.
5186,Asperiores debitis accusantium a.
5187,Ut quidem quibusdam repellendus.
5188,Consectetur sed accusamus sed.
5189,Voluptas fugit pariatur voluptatem.
5190,Qui aspernatur ut sint.
5191,Voluptatem consequatur ea placeat.
5192,Tenetur non dolore aliquid.
5193,Ab sint aut eveniet.
5194,Amet quam et et.
5195,Dolorum et est molestiae.
5196,Ipsam qui error rerum.
5197,Accusamus distinctio officia ratione.
5198,Ex velit quia enim.
5199,Beatae ipsam quo maiores.
5200,Excepturi error ipsum et.
5201,Dolor aut in sint.
5202,Hic commodi ea corporis.
5203,Ut est enim occaecati.
5204,Ipsa accusantium aperiam dolorem.
5205,Culpa tempore quos rerum.
5206,Voluptatem aut saepe veniam.
5207,Placeat voluptas beatae illum.
5208,Molestiae ducimus voluptate vel.
5209,Non laboriosam ut et.
5210,Vel distinctio fuga molestiae.
5211,Et voluptas veniam optio.
5212,Aliquid quia reiciendis vel.
5213,Deleniti numquam voluptates corporis.
5214,Voluptatum minus odit aperiam.
5215,Harum libero ipsum placeat.
5216,Consequatur et dolorum aliquam.
5217,Earum mollitia nobis nulla.
5218,Aut sit et mollitia.
5219,Laudantium ipsam magni et.
5220,Accusamus sed dolorem et.
5221,Commodi et ex dolorem.
5222,Libero explicabo corporis ducimus.
5223,Ipsum cumque officia eveniet.
5224,Molestiae et sit omnis.
5225,Aliquam consequatur dicta consequuntur.
5226,Unde aliquam eaque ipsa.
5227,Quo facere autem nihil.
5228,Totam cum voluptatum sunt.
5229,Quisquam ex labore similique.
5230,Ab corporis fugit nobis.
5231,Vel dolores facilis mollitia.
5232,Sunt qui sed est.
5233,Nemo ut voluptas quos.
5234,Eum modi eligendi non.
5235,Quia id deleniti corrupti.
5236,Ratione id et quae.
5237,Modi soluta itaque quod.
5238,Animi natus est id.
5239,Debitis officia voluptas quasi.
5240,Laboriosam qui molestiae at.
5241,Inventore quos porro ut.
5242,Magni nostrum a quibusdam.
5243,Dolorem praesentium distinctio quia.
5244,Dolorem omnis ipsam quasi.
5245,Ut consequatur minima eos.
5246,Veniam doloremque iure aliquid.
5247,Quis commodi repellendus quis.
5248,Quia rem praesentium aut.
5249,Est saepe esse inventore.
5250,Suscipit perspiciatis rerum qui.
5251,Voluptas atque beatae placeat.
5252,Autem molestias amet quisquam.
5253,Illum aut amet qui.
5254,Sint aut deleniti doloremque.
5255,Aliquam natus sed asperiores.
5256,Aut asperiores libero vitae.
5257,Rerum ut nisi et.
5258,Non fugiat et aperiam.
5259,Qui soluta accusamus blanditiis.
5260,Esse est autem aut.
5261,Minima vitae quibusdam adipisci.
5262,Provident nisi repellendus enim.
5263,Autem voluptas sint atque.
5264,Aut reprehenderit ad totam.
5265,Quas sed rem tempora.
5266,Nesciunt quo excepturi sunt.
5267,Nesciunt error fugiat dolorum.
5268,Culpa minima id vel.
5269,Inventore dolorem perferendis labore.
5270,Ea atque ab qui.
5271,Quia placeat quibusdam cupiditate.
5272,Accusantium error est qui.
5273,Accusamus consectetur blanditiis in.
5274,Qui et vitae cum.
5275,Ab aperiam culpa unde.
5276,Voluptatem consectetur quos temporibus.
5277,Perspiciatis praesentium eligendi maxime.
5278,Corrupti qui voluptas et.
5279,Facilis totam eum ratione.
5280,Ex similique occaecati animi.
5281,Eius et ipsa nihil.
5282,Voluptatem qui cupiditate reprehenderit.
5283,Ratione ut nulla quisquam.
5284,Aut saepe quas et.
5285,Quos veniam provident voluptate.
5286,Eum error distinctio magnam.
5287,Natus at incidunt laborum.
5288,Reiciendis et eaque harum.
5289,Ratione ea fuga occaecati.
5290,Ipsum quod vel sit.
5291,Accusamus eaque mollitia incidunt.
5292,Dolor cumque laudantium officia.
5293,Id error tenetur veritatis.
5294,Excepturi consequatur quisquam consequatur.
5295,Aliquam molestiae provident distinctio.
5296,Amet et assumenda labore.
5297,Cum dolore pariatur ut.
5298,Non voluptas culpa adipisci.
5299,Nobis fugit quisquam ut.
5300,Corporis commodi nesciunt harum.
5301,Accusamus ducimus rerum enim.
5302,Maiores quas autem et.
5303,Animi eum quia excepturi.
5304,Quidem in et laborum.
5305,Amet similique molestiae rerum.
5306,Sed id rerum consectetur.
5307,Ex adipisci qui neque.
5308,Asperiores iusto ducimus natus.
5309,Eos iure quia dolor.
5310,Eum consequatur consectetur corporis.
5311,Et et placeat ratione.
5312,At error nemo voluptatibus.
5313,Porro harum autem nisi.
5314,Perspiciatis cupiditate rerum odio.
5315,Placeat voluptatem voluptas minima.
5316,Voluptas velit quia quos.
5317,Harum ad quia eaque.
5318,Est expedita ipsum fugiat.
5319,Ut debitis molestias similique.
5320,Incidunt excepturi natus vel.
5321,Harum deleniti modi est.
5322,Odio ut quia veritatis.
5323,Earum nemo saepe quod.
5324,Ipsum esse assumenda magni.
5325,Quod iste quas error.
5326,Et quis ut doloremque.
5327,Consectetur deserunt quia voluptatem.
5328,Rerum consequatur commodi nostrum.
5329,Necessitatibus ab sint eum.
5330,In ipsa exercitationem totam.
5331,Quis aut nostrum sit.
5332,Quia perferendis deleniti dolores.
5333,Atque ut sunt quo.
5334,Sint sequi nisi id.
5335,Eum ullam suscipit aliquid.
5336,Magnam itaque delectus dolore.
5337,Exercitationem eos eum ratione.
5338,Necessitatibus placeat consequatur rerum.
5339,Reiciendis suscipit quia officia.
5340,Libero veritatis mollitia vero.
5341,Aspernatur iste est eligendi.
5342,Tenetur eum dolores consequatur.
5343,Sunt libero occaecati dolore.
5344,Rerum repudiandae omnis nisi.
5345,Esse explicabo consequatur ea.
5346,Praesentium aut cupiditate odit.
5347,Consequatur et nulla qui.
5348,Accusamus officia consequatur quia.
5349,Quisquam nulla recusandae qui.
5350,Quasi architecto possimus accusamus.
5351,Earum est esse cupiditate.
5352,Mollitia ut et aut.
5353,Id qui nihil aut.
5354,Corporis ratione dolorum et.
5355,Est et et necessitatibus.
5356,Eos impedit in error.
5357,Dolor repellat neque laborum.
