recipe_id,note_descript
2322,Quis modi quidem voluptates.
2323,Maxime incidunt nisi laborum.
2324,Voluptatem veniam veritatis dolor.
2325,Eaque eum harum quo.
2326,Aut blanditiis quae odit.
2327,Perspiciatis ut optio est.
2328,Sint aut eum consequuntur.
2329,Nam perspiciatis in consequatur.
2330,Non neque numquam quaerat.
2331,Provident qui mollitia officiis.
2332,Et omnis quasi cupiditate.
2333,Voluptate quo temporibus repellendus.
2334,Ratione quia ea facilis.
2335,Consequuntur earum delectus quae.
2336,Pariatur at perferendis ab.
2337,Nobis aliquid maxime fuga.
2338,Ab temporibus ipsa voluptatem.
2339,Dolorem quis sit rerum.
2340,Autem nisi aut et.
2341,Et occaecati ab vitae.
2342,Beatae tenetur et ut.
2343,Et in voluptas ab.
2344,Atque cum quis doloremque.
2345,Quisquam doloremque cupiditate quae.
2346,Earum recusandae fuga neque.
2347,Quidem ratione distinctio non.
2348,Voluptas id accusamus consectetur.
2349,Minus ut cupiditate molestiae.
2350,Facilis alias illo nemo.
2351,Qui vel labore velit.
2352,Sunt veritatis sequi voluptate.
2353,Exercitationem et impedit eveniet.
2354,Ut enim quis quia.
2355,Minima sint est eveniet.
2356,Odio vel dolore ut.
2357,Fuga soluta et doloribus.
2358,Eius voluptas laborum adipisci.
2359,Incidunt vel dolorum repellat.
2360,Sit repudiandae incidunt eaque.
2361,Odio possimus architecto et.
2362,Non aut expedita voluptatem.
2363,Ea dolor aut voluptatibus.
2364,Maiores perspiciatis accusantium voluptatum.
2365,In officiis non dolor.
2366,Et tenetur rerum qui.
2367,Velit voluptate commodi ipsam.
2368,Quia porro nostrum veniam.
2369,In quo dicta eaque.
2370,Quae autem vel excepturi.
2371,Voluptatem minima harum quo.
2372,Quia ipsum est dolorem.
2373,Deleniti quo recusandae tempore.
2374,Voluptatem dolore ut et.
2375,Ut delectus ea dignissimos.
2376,Id qui quas ut.
2377,Et soluta qui nulla.
2378,Esse repudiandae alias nisi.
2379,Molestiae ut consectetur maxime.
2380,Iure fugit eveniet omnis.
2381,Quam sint magni maxime.
2382,Dolorum dolores voluptatem autem.
2383,Et pariatur nemo ut.
2384,Eos nulla excepturi magnam.
2385,Non atque quas magni.
2386,Laboriosam ullam praesentium porro.
2387,Quisquam quae soluta enim.
2388,Alias aperiam tenetur harum.
2389,Sint cumque accusamus mollitia.
2390,Voluptas sed voluptatibus at.
2391,Non aut aperiam vero.
2392,Dolor sapiente temporibus ut.
2393,Nihil est deleniti saepe.
2394,Iste libero quaerat in.
2395,Et aut in consequatur.
2396,Dolores quis expedita vero.
2397,Deleniti occaecati iste laboriosam.
2398,Alias est quidem in.
2399,Dolores dolorum eum occaecati.
2400,Doloribus incidunt sit quia.
2401,Et beatae qui molestias.
2402,Nesciunt exercitationem dolor rerum.
2403,Laborum voluptas est odio.
2404,Quae id enim assumenda.
2405,Odio quam necessitatibus debitis.
2406,Voluptates iste et dolor.
2407,Et pariatur magni laborum.
2408,Veniam autem quis earum.
2409,Eaque ea exercitationem eligendi.
2410,Fuga et aut aut.
2411,Voluptate porro vero sed.
2412,Maiores illum ex nihil.
2413,A error corrupti eos.
2414,Ipsam in unde vel.
2415,Ut enim quia tempora.
2416,Sunt recusandae quibusdam vitae.
2417,Odit voluptas culpa quo.
2418,Qui voluptatibus ab pariatur.
2419,Voluptates fugit id voluptatem.
2420,Perspiciatis incidunt recusandae non.
2421,Sapiente molestiae autem consequatur.
2422,Dolorum est molestiae voluptate.
2423,Sint et eum architecto.
2424,Corporis provident laborum fugit.
2425,Sed eos omnis alias.
2426,Sint modi labore tempora.
2427,Omnis cumque nam sequi.
2428,Inventore error dignissimos quis.
2429,Eos doloremque laborum error.
2430,In ducimus odit minus.
2431,Corporis ratione in porro.
2432,Sint aut sed qui.
2433,Animi ullam velit explicabo.
2434,Nemo explicabo similique eligendi.
2435,Vitae magni neque aut.
2436,Consequatur dolores ab enim.
2437,Qui sit sunt esse.
2438,Excepturi impedit quis ipsam.
2439,Odio eaque et aut.
2440,Sunt nemo fugit distinctio.
2441,Neque est ut magnam.
2442,Fugit pariatur illo voluptas.
2443,Sed sit assumenda non.
2444,Ut deserunt sunt sapiente.
2445,Et vero adipisci quam.
2446,Eaque maiores sunt facilis.
2447,Aut aut fugiat aut.
2448,A et reiciendis aut.
2449,Cupiditate pariatur impedit est.
2450,Vitae consectetur atque error.
2451,Placeat rerum et voluptas.
2452,Magni excepturi ut incidunt.
2453,Sapiente dolores enim sunt.
2454,Sed adipisci dicta sed.
2455,Itaque ut repellat minus.
2456,Assumenda consequuntur corrupti doloremque.
2457,Numquam tempora omnis nemo.
2458,Deserunt inventore deleniti doloribus.
2459,Accusamus id praesentium perspiciatis.
2460,Vitae ut sunt temporibus.
2461,Dolorem error aspernatur optio.
2462,Ut aut ea qui.
2463,Asperiores ut hic quae.
2464,Esse sed omnis occaecati.
2465,Sit quae quos consequatur.
2466,Doloremque deleniti autem alias.
2467,Consequatur quis ipsum eligendi.
2468,Ut animi fugiat consequatur.
2469,Officia omnis qui praesentium.
2470,Est ut dignissimos accusamus.
2471,Qui nam molestias nulla.
2472,Cumque aperiam nihil pariatur.
2473,Dolorem quidem ut quaerat.
2474,Maiores et magni est.
2475,Eaque quod ipsam quo.
2476,Ducimus minima soluta fuga.
2477,Voluptates laboriosam laudantium repellat.
2478,Exercitationem libero aliquid temporibus.
2479,Odio nihil possimus et.
2480,Laudantium id reprehenderit sed.
2481,Voluptatibus nemo ipsam ut.
2482,Nam nemo voluptatem soluta.
2483,Dolores voluptas et aliquid.
2484,Omnis illum eaque sit.
2485,Eos quae dolorem delectus.
2486,Ea velit dolore sequi.
2487,Qui eveniet ipsum vitae.
2488,Ratione corporis placeat aut.
2489,Sunt pariatur blanditiis totam.
2490,Sit molestias vitae nobis.
2491,Ad voluptates sit est.
2492,Molestias et autem tenetur.
2493,Dolorem voluptatibus aperiam consequatur.
2494,Magnam voluptate provident est.
2495,Enim illum vel culpa.
2496,Ipsum qui perspiciatis suscipit.
2497,Dolores quia veritatis et.
2498,Molestiae nulla recusandae qui.
2499,Omnis adipisci quis nisi.
2500,Labore neque iusto temporibus.
2501,Voluptatem odio incidunt culpa.
2502,Est qui quam voluptates.
2503,Qui sunt maxime maiores.
2504,Omnis dolore laboriosam voluptatibus.
2505,Temporibus eum qui omnis.
2506,Ut et laudantium ut.
2507,Et tenetur ex quisquam.
2508,Earum dicta ducimus maiores.
2509,Aut consequatur corporis laudantium.
2510,Et et eius labore.
2511,Et harum explicabo qui.
2512,Praesentium quo autem ut.
2513,Facere dolorem omnis velit.
2514,Voluptates sed mollitia consequatur.
2515,Dolor possimus fugiat ratione.
2516,Laudantium commodi quaerat cum.
2517,Provident accusantium itaque nulla.
2518,Voluptatem sed quia iusto.
2519,Qui dolores quo labore.
2520,Asperiores aperiam voluptas distinctio.
2521,Pariatur nobis commodi cupiditate.
2522,Ratione eveniet quos id.
2523,Exercitationem expedita iure sequi.
2524,Non dolor inventore illo.
2525,Omnis eaque deleniti dolorem.
2526,Ut voluptas dolore occaecati.
2527,Quod magnam qui et.
2528,Soluta in saepe pariatur.
2529,Blanditiis porro sit animi.
2530,Qui et neque cumque.
2531,Non facere odit autem.
2532,Aut perspiciatis rerum et.
2533,Deleniti optio esse rerum.
2534,Deleniti in mollitia nisi.
2535,Animi tempora nostrum aliquam.
2536,Ut eveniet itaque voluptates.
2537,Est corrupti facere eos.
2538,Optio molestias nihil cupiditate.
2539,Molestiae non illum debitis.
2540,At id recusandae aliquid.
2541,Amet ut quos dolorem.
2542,Possimus ipsum exercitationem amet.
2543,Sapiente debitis atque odio.
2544,Iste ipsum rerum beatae.
2545,Et iure est dicta.
2546,Doloremque aut omnis soluta.
2547,Dolorem aperiam dolorum veritatis.
2548,Eaque tenetur ratione aut.
2549,Magnam rerum totam eos.
2550,At consequatur voluptas dolores.
2551,Vitae odit doloremque tempore.
2552,Soluta iste praesentium perferendis.
2553,Alias deleniti voluptatem aperiam.
2554,Provident maxime commodi voluptatem.
2555,Illo cum enim eveniet.
2556,Inventore animi natus ut.
2557,Quisquam quos asperiores officia.
2558,Illum rem rerum dolores.
2559,Quis esse atque nesciunt.
2560,Eveniet aperiam sunt cumque.
2561,Dignissimos eum laborum vel.
2562,Repudiandae quasi ipsa adipisci.
2563,Et sint quia culpa.
2564,Sint omnis sed error.
2565,Suscipit deserunt excepturi aut.
2566,Et dolor consequuntur adipisci.
2567,Cupiditate porro dolore modi.
2568,Cupiditate expedita ratione qui.
2569,At debitis ea tenetur.
2570,Cumque tempora rerum sed.
2571,Est quas sit perspiciatis.
2572,Velit laborum placeat qui.
2573,Dolores omnis aut nobis.
2574,Doloribus aperiam perspiciatis dolorem.
2575,Non ut molestiae quis.
2576,Omnis non maiores quia.
2577,Repellat dolorum recusandae magnam.
2578,Et repellendus et est.
2579,Sint molestiae cum culpa.
2580,Eos aut quam velit.
2581,Eum id et neque.
2582,Illo aut placeat unde.
2583,Eos labore qui voluptates.
2584,Dolorum asperiores quae corrupti.
2585,Voluptatem a ad dolorem.
2586,Quaerat et enim ut.
2587,Dolore veritatis nulla aut.
2588,Ut beatae nam odit.
2589,Cumque et voluptate molestias.
2590,Atque excepturi sunt maxime.
2591,Minus velit excepturi aut.
2592,Nisi consequatur in temporibus.
2593,Beatae unde quia delectus.
2594,Maiores necessitatibus quia eius.
2595,Impedit necessitatibus iusto vel.
2596,Eum dolorem ipsum accusamus.
2597,Cum quia ut dolor.
2598,Fugit et consequatur tempore.
2599,Alias explicabo ex sit.
2600,Quibusdam ducimus tempore reiciendis.
2601,Magnam repellendus a ullam.
2602,Quis corrupti id adipisci.
2603,Est eos ullam non.
2604,Veritatis est aut non.
2605,Magni sed quis eveniet.
2606,Qui officiis eum ullam.
2607,Provident voluptas dolor qui.
2608,Quae nihil fugiat et.
2609,Sint nulla dicta blanditiis.
2610,Ut voluptatum consequatur eos.
2611,Aspernatur a omnis labore.
2612,Est molestias voluptatum non.
2613,Tempora expedita esse distinctio.
2614,Pariatur architecto corporis eligendi.
2615,Et voluptatem in qui.
2616,Ex illum porro est.
2617,Atque ea voluptatem et.
2618,Labore veniam et sit.
2619,Consequuntur sed unde ut.
2620,Laboriosam aut aliquid consectetur.
2621,Omnis et odio eum.
2622,Eos nobis vel suscipit.
2623,Nobis accusamus aut quibusdam.
2624,Nesciunt velit reiciendis iusto.
2625,Omnis praesentium vel iste.
2626,Et natus odit quidem.
2627,Est excepturi qui eveniet.
2628,Voluptatem illum aut quaerat.
2629,Perspiciatis culpa amet ut.
2630,Veniam et ut id.
2631,Autem dolores ut odit.
2632,Odio soluta ut veritatis.
2633,Et quibusdam iusto voluptatem.
2634,Exercitationem voluptatem molestiae dolorem.
2635,Asperiores sit fuga dignissimos.
2636,Officiis eum qui totam.
2637,Ducimus a ratione maiores.
2638,Asperiores provident numquam quas.
2639,Suscipit officia tempora distinctio.
2640,Voluptatem eos dicta culpa.
2641,Animi incidunt dolorem maiores.
2642,Occaecati eius quidem harum.
2643,Possimus ab nisi eum.
2644,Quod et aut consequuntur.
2645,Quibusdam maiores fugit et.
2646,Dolor non et molestiae.
2647,Et molestiae ea a.
2648,Libero unde adipisci accusamus.
2649,Sit reprehenderit eos cupiditate.
2650,Amet voluptatem ex saepe.
2651,Molestiae quis omnis vero.
2652,Itaque magni et nulla.
2653,Ipsam fugit ut placeat.
2654,Dignissimos natus assumenda impedit.
2655,Minima dolore qui voluptas.
2656,Temporibus id cum eius.
2657,Voluptatem velit et dolor.
2658,Est occaecati rerum deleniti.
2659,Et libero iure voluptatem.
2660,Sint id magni et.
2661,Eligendi nisi non nihil.
2662,Harum repellat optio ut.
2663,Laborum id rerum laudantium.
2664,Ratione ducimus modi ut.
2665,Vero aut assumenda aut.
2666,Repudiandae qui qui non.
2667,Fuga sit id sit.
2668,Dignissimos laudantium sed vero.
2669,Dolores rem modi id.
2670,Quas quos consequatur autem.
2671,Veritatis consequatur ut quia.
2672,Voluptas ea aut rerum.
2673,Ut repudiandae non iusto.
2674,Et error eligendi quae.
2675,Asperiores veritatis sit iste.
2676,Labore sit pariatur debitis.
2677,Labore voluptas cum dolores.
2678,Vitae maiores qui aut.
2679,Totam aut quos sequi.
2680,Non saepe distinctio vel.
2681,Qui eligendi et eum.
2682,Aut officia rerum deserunt.
2683,Quasi pariatur quos tenetur.
2684,Asperiores accusantium optio rerum.
2685,Ut voluptatem perferendis architecto.
2686,Minus perferendis sunt voluptas.
2687,Blanditiis delectus accusamus sint.
2688,Quaerat voluptas voluptate vel.
2689,Sit ut consequuntur reiciendis.
2690,Voluptatibus molestias dolores omnis.
2691,Quo voluptatibus quibusdam deserunt.
2692,Provident placeat ea ratione.
2693,Minima dicta quae ab.
2694,Molestias eaque iusto vel.
2695,Accusamus cupiditate sit voluptas.
2696,Aut cupiditate doloribus rerum.
2697,Molestias quam debitis non.
2698,Est sequi occaecati sint.
2699,Rerum a distinctio ut.
2700,Fuga omnis commodi eius.
2701,Omnis similique non eveniet.
2702,Corporis tempore facilis sint.
2703,Enim nobis quia doloremque.
2704,Deserunt qui omnis incidunt.
2705,Asperiores voluptatem consequatur nisi.
2706,Illo voluptates tempore impedit.
2707,Recusandae sint et iusto.
2708,Blanditiis nesciunt rerum ut.
2709,Dicta saepe natus qui.
2710,Fuga iste sed sed.
2711,Aut magni sit suscipit.
2712,Provident recusandae consequatur autem.
2713,Neque et qui aut.
2714,Quasi quibusdam eius facere.
2715,Quos quo libero impedit.
2716,Excepturi ab minima nulla.
2717,Rem recusandae officia soluta.
2718,Id sed nam tenetur.
2719,Voluptatem aut quasi aut.
2720,Reprehenderit deleniti repudiandae at.
2721,Deserunt perspiciatis atque numquam.
2722,Ducimus consectetur repellat dolores.
2723,Beatae a et omnis.
2724,Sint eum iure explicabo.
2725,Eveniet facere rerum excepturi.
2726,Est totam quia nihil.
2727,Ut similique cumque voluptatem.
2728,Atque voluptatem in aut.
2729,Est odit quasi alias.
2730,Quod aut enim qui.
2731,Adipisci labore natus officiis.
2732,Reprehenderit quibusdam tenetur veritatis.
2733,Magni voluptates est amet.
2734,Molestiae ut impedit eaque.
2735,Natus et harum ratione.
2736,Consequatur delectus eligendi facere.
2737,Hic sint eum repellendus.
2738,Perferendis optio est alias.
2739,Non odit nulla totam.
2740,Aliquid repellendus alias quibusdam.
2741,Temporibus itaque sint assumenda.
2742,Dolores sed quam sapiente.
2743,Omnis rem molestiae modi.
2744,Omnis tenetur magnam porro.
2745,Quae hic harum maiores.
2746,Velit aliquam optio tempore.
2747,Tempora placeat dolorum dignissimos.
2748,Velit sit voluptas repudiandae.
2749,Corporis reprehenderit itaque saepe.
2750,Ducimus asperiores ut aperiam.
2751,Sed ea reprehenderit iste.
2752,Earum aliquam voluptatibus voluptatem.
2753,Omnis nulla doloremque natus.
2754,Laborum rerum incidunt repellendus.
2755,Sit et quis aut.
2756,Et expedita quia qui.
2757,Reiciendis quos cupiditate ipsum.
2758,Ut rerum eveniet omnis.
2759,Qui est iste laborum.
2760,Quae eum et molestiae.
2761,Voluptas eos quia voluptatem.
2762,Aut laboriosam nulla harum.
2763,Esse necessitatibus atque numquam.
2764,Placeat rerum qui dignissimos.
2765,Nihil enim expedita quo.
2766,Soluta possimus ducimus nisi.
2767,Sit rerum repudiandae ea.
2768,Quibusdam dolorem aut animi.
2769,Molestiae optio non quidem.
2770,Dolores maiores aliquid atque.
2771,Explicabo in aliquid eos.
2772,Esse qui at reiciendis.
2773,Quae et fuga ut.
2774,Sapiente molestiae mollitia occaecati.
2775,Saepe sint hic commodi.
2776,Corporis laborum iure placeat.
2777,Ab reprehenderit velit est.
2778,Fuga eum iusto excepturi.
2779,Ut blanditiis et tempore.
2780,Eius ut repellat et.
2781,Ut nobis magni magnam.
2782,Non tempora voluptate repellat.
2783,Voluptas rem et et.
2784,Tempore assumenda rerum optio.
2785,Excepturi eligendi consequatur reiciendis.
2786,Atque amet perferendis quae.
2787,Et ipsam repellendus eius.
2788,Est quisquam quod harum.
2789,Voluptate velit qui consequuntur.
2790,Corrupti aperiam ab ad.
2791,Voluptatem et explicabo est.
2792,Sit et expedita tempora.
2793,Pariatur et eos omnis.
2794,Est quam voluptatem occaecati.
2795,Et illo error eligendi.
2796,Expedita sint autem et.
2797,Sit laudantium qui dolorem.
2798,Dolorem culpa et est.
2799,Nostrum dolores quaerat voluptas.
2800,Dolores ullam harum repellat.
2801,Dolorum eum unde molestias.
2802,Corporis aut qui mollitia.
2803,Ducimus consequatur praesentium ea.
2804,Repellat incidunt ea laboriosam.
2805,Facere earum voluptas odit.
2806,Reiciendis modi sint quia.
2807,Possimus quia omnis ratione.
2808,Sit facere expedita eos.
2809,Qui eius recusandae rem.
2810,Officiis sit nihil et.
2811,Reprehenderit qui maiores rerum.
2812,Dolorem iure quibusdam ipsum.
2813,Enim debitis dolores explicabo.
2814,Dolores quae esse nobis.
2815,Molestias ratione distinctio aut.
2816,Sed assumenda nulla reiciendis.
2817,Ut neque ut temporibus.
2818,Sed velit nihil reiciendis.
2819,Minus laudantium dolor cum.
2820,Eos praesentium totam ratione.
2821,Ut recusandae qui quia.
2822,Doloribus rerum atque dolores.
2823,Dolor molestiae ratione ut.
2824,Quo fugit quisquam tempore.
2825,Eum harum voluptatum non.
2826,Dolore repellendus voluptatibus assumenda.
2827,Voluptatibus culpa nulla illum.
2828,Laboriosam illo esse ratione.
2829,Suscipit vitae adipisci asperiores.
2830,Repudiandae quidem fugiat aut.
2831,Molestiae et voluptas iure.
2832,Aut odit qui ut.
2833,Voluptates adipisci vel minima.
2834,Sapiente vel nostrum sed.
2835,Est fugit qui odio.
2836,Ea tempore quia ut.
2837,Quis ratione voluptates ut.
2838,Dolorum ut molestias nisi.
2839,Velit quam est quisquam.
2840,Molestias nulla numquam ut.
2841,Asperiores architecto cumque ex.
2842,Eum sint et alias.
2843,Ut voluptatum est non.
2844,Qui recusandae non iste.
2845,Assumenda consequuntur labore enim.
2846,Modi ipsum recusandae sint.
2847,Magnam enim unde incidunt.
2848,Placeat aspernatur veritatis vel.
2849,Rerum nostrum omnis debitis.
2850,Et cum provident ut.
2851,Deleniti ratione autem quibusdam.
2852,Veritatis consequatur earum omnis.
2853,Reprehenderit ex voluptates harum.
2854,Laboriosam fuga voluptatum rem.
2855,Et nam animi harum.
2856,Et recusandae iste alias.
2857,Nihil voluptas rerum accusantium.
2858,A aliquid incidunt occaecati.
2859,Repellendus mollitia cum maiores.
2860,Tempora magnam et tempore.
2861,In voluptatem modi sunt.
2862,Qui sequi autem itaque.
2863,Voluptatem in explicabo asperiores.
2864,Nam est in hic.
2865,Vitae commodi omnis earum.
2866,Quis ut quod aut.
2867,Nisi eveniet rerum nobis.
2868,Temporibus natus consequatur quae.
2869,Veritatis ut libero ut.
2870,Voluptatem illo molestiae cum.
2871,Mollitia sit ratione qui.
2872,Aut dicta magnam et.
2873,Magni est possimus in.
2874,Rerum eum rerum quisquam.
2875,Adipisci sed vitae quidem.
2876,Et iure ut mollitia.
2877,Eveniet quia aut eum.
2878,Alias quisquam cum autem.
2879,Labore voluptatem soluta quas.
2880,Quasi aut necessitatibus quibusdam.
2881,Ab qui nulla voluptatem.
2882,Vero quos amet quas.
2883,Aut sed totam quidem.
2884,Laborum similique quo qui.
2885,Impedit quia quaerat et.
2886,Aliquam nihil voluptatum dolor.
2887,Quo aut odit placeat.
2888,Reprehenderit qui delectus ad.
2889,Eum molestiae quo adipisci.
2890,Quia saepe beatae iste.
2891,Tenetur eveniet omnis rerum.
2892,Voluptatem vel numquam sit.
2893,Esse eos reprehenderit qui.
2894,Aut aut fugiat sit.
2895,Veniam quo quidem deserunt.
2896,Voluptatibus harum ut sint.
2897,Ad distinctio harum ea.
2898,Dolorum reiciendis eum sunt.
2899,Inventore voluptatem suscipit sint.
2900,Qui voluptatem repudiandae sed.
2901,Quo quibusdam nulla reiciendis.
2902,Iste est quo totam.
2903,Voluptates et deserunt nobis.
2904,Veniam cum in suscipit.
2905,Veniam neque placeat molestias.
2906,Molestiae et qui inventore.
2907,Labore est est nemo.
2908,Magni sunt assumenda saepe.
2909,Ut animi qui quidem.
2910,Qui voluptas adipisci totam.
2911,Dicta error iure non.
2912,Enim error aperiam odit.
2913,Id officiis culpa iure.
2914,Aliquid veniam ab praesentium.
2915,Labore nobis praesentium soluta.
2916,Reprehenderit consequatur qui possimus.
2917,Quasi tempore quis hic.
2918,Est autem impedit ullam.
2919,Voluptatem commodi ullam iste.
2920,Et dolore animi aut.
2921,Quae molestiae quia fugiat.
2922,Sequi rerum quas tempore.
2923,Perspiciatis quia velit aspernatur.
2924,Officia et repellat eligendi.
2925,Voluptatum itaque deserunt veniam.
2926,Eaque minus est laudantium.
2927,Dolor inventore error omnis.
2928,Autem nulla optio adipisci.
2929,Dolore saepe quo fuga.
2930,Perspiciatis veniam sint libero.
2931,Molestias omnis beatae sed.
2932,Ut eaque facere vitae.
2933,Neque adipisci nihil beatae.
2934,Laboriosam nisi quis ut.
2935,Aut ea est sequi.
2936,Cupiditate voluptatem nostrum molestiae.
2937,Sint repellat autem sint.
2938,Quibusdam itaque cumque dolore.
2939,Voluptatem id sit sapiente.
2940,Rerum qui aut commodi.
2941,Optio vitae ab incidunt.
2942,Quae neque velit provident.
2943,Iste hic in ut.
2944,Pariatur qui et voluptates.
2945,Et illo assumenda omnis.
2946,Et laboriosam earum harum.
2947,Saepe doloribus magni ut.
2948,Iste facere debitis illum.
2949,Aliquam officia minima quam.
2950,Voluptatem vel et molestiae.
2951,Minus libero non sed.
2952,Id in tempore ea.
2953,Et sit est mollitia.
2954,Rem dolor ut fugiat.
2955,Possimus et doloribus repudiandae.
2956,Nobis incidunt ut magni.
2957,Dolorem quos aut maiores.
2958,Officiis eius earum nulla.
2959,Velit delectus est pariatur.
2960,Ratione ipsa eveniet commodi.
2961,Explicabo quibusdam perspiciatis eius.
2962,Culpa qui soluta quia.
2963,Sunt placeat aperiam occaecati.
2964,Et quasi ut facere.
2965,Nam necessitatibus quis aliquam.
2966,Ratione dolorem consequatur nemo.
2967,Illo quo eos a.
2968,Sapiente itaque quasi nulla.
2969,Suscipit voluptatibus sapiente quis.
2970,Placeat alias atque aliquam.
2971,Ut sequi facere qui.
2972,Dolorem consectetur nesciunt nisi.
2973,Sint sit cupiditate officia.
2974,Iusto dignissimos odit voluptatem.
2975,Alias doloribus delectus temporibus.
2976,Atque minima omnis eum.
2977,Minus qui omnis ea.
2978,Labore quos perferendis ea.
2979,Ut veritatis voluptatem explicabo.
2980,Provident iure quos maxime.
2981,Ut id saepe praesentium.
2982,Dolor pariatur quia illum.
2983,Error accusantium ex recusandae.
2984,Deserunt eaque et dolorem.
2985,Est commodi quos voluptatem.
2986,Et omnis doloribus similique.
2987,Magni et dolor ea.
2988,Deserunt consequatur sit temporibus.
2989,Accusantium repellat consequatur tempore.
2990,Soluta est ex ea.
2991,Rem nobis doloribus soluta.
2992,Autem dolores dicta quia.
2993,Dolorem est cumque illo.
2994,Et tempora nostrum omnis.
2995,Veniam voluptatem id velit.
2996,Saepe ut pariatur libero.
2997,Magnam possimus voluptatem vero.
2998,Dolore numquam voluptatem molestiae.
2999,Est veritatis adipisci recusandae.
3000,Porro facilis dolorem pariatur.
3001,Expedita est ut cum.
3002,Eum ullam quod nihil.
3003,Facere nobis sed aperiam.
3004,Voluptate placeat assumenda quasi.
3005,Consectetur nobis sed sint.
3006,Porro laboriosam tenetur sed.
3007,Atque sunt soluta reprehenderit.
3008,Est ipsum commodi et.
3009,Corporis esse laudantium et.
3010,Dignissimos ut fugiat eum.
3011,Aut perferendis est corrupti.
3012,Sed officiis voluptatem expedita.
3013,Sed voluptatem voluptas accusamus.
3014,Dolorem assumenda rerum eveniet.
3015,Et atque itaque rerum.
3016,Totam expedita laudantium nam.
3017,Quis enim numquam molestiae.
3018,Aut ex alias iure.
3019,Autem voluptatibus quidem consectetur.
3020,Assumenda quia itaque ex.
3021,Ipsa nisi temporibus architecto.
3022,Et iste adipisci et.
3023,Autem consequatur facilis sint.
3024,Nisi reiciendis aut cumque.
3025,Quia quia dicta quisquam.
3026,Praesentium id impedit molestiae.
3027,Qui explicabo culpa fugiat.
3028,Consequatur ratione voluptatem dolore.
3029,Occaecati sit eum nesciunt.
3030,Libero quia blanditiis sapiente.
3031,Et esse corrupti hic.
3032,Optio quia magnam tempore.
3033,Voluptas dolorem impedit consequatur.
3034,Iusto illum neque quam.
3035,Voluptas tempora sed veritatis.
3036,Sapiente in qui quasi.
3037,Qui unde ex nihil.
3038,Possimus eaque saepe maxime.
3039,Sint quis eum expedita.
3040,At et sed unde.
3041,Aut rem aut explicabo.
3042,Repellat consequatur et voluptas.
3043,Aperiam neque dolore aut.
3044,Et eveniet unde ut.
3045,Officia laudantium accusamus omnis.
3046,Magnam quaerat illo rerum.
3047,Repudiandae assumenda facilis et.
3048,Error quae debitis aspernatur.
3049,Molestias aut aut numquam.
3050,Porro est sit iure.
3051,Ut omnis quia hic.
3052,Autem et earum velit.
3053,Occaecati accusamus eligendi autem.
3054,Et qui nesciunt quo.
3055,Nisi in optio voluptatum.
3056,Aut fugit ut sunt.
3057,Quia dolor voluptates omnis.
3058,Veritatis quidem amet velit.
3059,Ea et in odit.
3060,Rem asperiores dolore velit.
3061,Sapiente minima aut fugiat.
3062,Aspernatur non sunt quia.
3063,Dolorum amet nam sint.
3064,Non repellat culpa incidunt.
3065,Pariatur consequuntur aliquam itaque.
3066,Et eius eum nulla.
3067,Molestiae enim ad rerum.
3068,Dolores excepturi quo fugit.
3069,Voluptas qui inventore quia.
3070,Asperiores fugit illo velit.
3071,Omnis odit minima et.
3072,Mollitia fuga atque minima.
3073,Optio illum velit quia.
3074,Molestias quia suscipit aspernatur.
3075,Et temporibus vel voluptate.
3076,Quasi ut officiis hic.
3077,Veniam sapiente commodi suscipit.
3078,Pariatur ut qui rerum.
3079,Voluptatem nisi totam repellendus.
3080,Reiciendis error libero enim.
3081,Iusto ut quo in.
3082,Est laudantium esse commodi.
3083,Repellendus sapiente tempore ex.
3084,Odit esse voluptatem et.
3085,Dolor velit nam iusto.
3086,Suscipit aliquam voluptate cupiditate.
